Id,Screen_name,Created_at,Text,Url,Hastags,Symbols
1601952258291388416,bbcazeri,2022-12-11 14:49:15+00:00,"Azərbaycan XİN-in mətbuat katibi Ayxan Hacızadə bildirib ki, dekabrın 10-da Rusiya sülhməramlılarının ""heç bir tədbir görməməsi fonunda"" onların müvəqqəti yerləşdiyi ərazidə ""qanunsuz istismar"" olunan yataqlara Azərbaycan rəsmilərinin səfər etmək cəhdinə ""maneçilik törədilib."" https://t.co/nkHGslYFjv",No url,[],[]
1601913239931174913,bbcazeri,2022-12-11 12:14:13+00:00,"Bakının Binəqədi və Nəsimi rayonlarının bir hissəsinə içməli suyun verilişində fasilə yaranıb.
Bunu Azərsu şirkətinin mətbuat katibi Anar Cəbrayıllı bildirib.
Onun sözlərinə görə, fasilə magistral su kəmərində baş vermiş qəza ilə əlaqədardır. https://t.co/8bf0vCoKu9",No url,[],[]
1601887330079576064,bbcazeri,2022-12-11 10:31:15+00:00,"Türkiyədə elektron siqaretlərin satışına və idxalına iki ildir ki, qadağa qoyulmasına baxmayaraq onların internetdə satışı davam edir. Google-da ""elektron siqaret"" sözünü axtarışa verəndə bir çox şirkətin bu məhsulun satışıyla məşğul olduğu üzə çıxır.
https://t.co/ZK1FAIDNUm https://t.co/puSsnMxPH9",https://t.co/ZK1FAIDNUm,[],[]
1601792423050592256,bbcazeri,2022-12-11 04:14:08+00:00,"Təbiətə milyonlarla mikroplastik səpələyən uşaq yeməyi butulkalarından, yaş salfetlərdən, uşaq bezlərindən və dayanıqsız materiallardan hazırlanmış digər məhsullardan istifadə etmək vərdişi çox geniş yayılıb. Bundan yan durmaq mümkündürmü? https://t.co/XuKlexMcSS https://t.co/HMv7w7ELTD",https://t.co/XuKlexMcSS,[],[]
1601774970581008384,bbcazeri,2022-12-11 03:04:47+00:00,"Rəsmilər danışıqların zamanı ilə bağlı fikir bildirməyə son dərəcə ehtiyatla yanaşırlar, bu niyə baş verir? Bu keçiddən oxuyun - https://t.co/VKqrHgnZ8R https://t.co/lABMk62Bhv",https://t.co/VKqrHgnZ8R,[],[]
