,Text
1629,ərzaq çatdır bil meşə dağ oln bəzə gecikmə ol bil məsələ tezliklə ara qaldırıl inan kimsə əsgəri pay sak sakn var on dövləti hüquq mühafizə orqan taq ciyər çıxarma deputat de
1630,erməni yaxın müxalif qüvvə toplaş vətən qurtuluş hərəkat ümum itaətsizlik aksiya başla
1631,post dövr
1632,sürücü em əl karantin qayda poz manat cərimələn yük maşın idarə e şəxs cəza qanunsuz hesab edi nazik kabinet qərar karantin günlə yükdaşıma hərəkət icazə veril məsələn araşdırıl bildiril
1633,neçə gün öncə sosial şəbəkə küçə it kütləvi şəkil öldürülmə video yayıq hadisə z şəhər yerli sakin tərəf çəkil fa paylaş ölmüş heyvan güllə yara ətrak güllə giliz aşkarla
1634,kor yeni növ mutasiya avstriy it niderland böyük b hava məkan qapa
1635,azərbaycan kor yeni yoluxma fakt qeyd alıq nəfər sağ ev buraxıl nəfər vəfat edi
1636,azərbaycan ordu nəzarət keçən ağ spitakashe kəndi qaf hava liman yaxın ol göstərən foto qırmızı xətti içəri tərək aeroport tərək ağ kəndi aid ox işarə göstəril yer hava liman uçuş zola
1637,sosial şəbəkə əsgər narazılıq yayılma davam edi əsgər ailə maddi sıxıntı içində ol dövlət qurumla dəstək gəlmə de özlə müharibə bitmə baxmayaraq ev buraxılma gileylən
1638,azərbaycan son su nəfər covi yoluq nəfər sağ nəfər vəfat edi
1639,günü əsas xəbər yeni il bağlı kütləvi tədbir icazə verilmə hərbi qulluqçu böyük qrup medal təltif edil ilham əl ilin əvvəli peyvəndləmə başlama planlaşdır
1640,hərbi səfərbərlik döyük aparıl növbəti əsgər video müraciət yak müharibə gedər geri yaşlı övlad burax əsgər de kim zəng vur ailə borc istəmə yorul yerli icra hakimiyyət hərbi komissarlıq səs səs vermə
1641,yeni il gecə restoran bayram tədbir qadağan
1642,ilham əl başçı sammit azərbaycan kor qarşı vaksinasiya ilin əvvəli başlanma planlaşdırıl peyvənd pulsuz könüllü olacaq
1643,yüz minlərlə insan qara təhsil cəlb edər təhsil müəssisə universitet qurma məcburi köç yanaşı milyon vətəndaş böyük qayıdış azad olun torpaqla yaşama imkan yaratma zahid oruc de
1644,günü əsas xəbər erməni zəng işğal olun ərazi azərbaycan qaytarma put er quyruq bulaq bak xəstəxana oksigen balon dayaq öl ol deyil
1645,dekabr gecə saat fövqəladə hal nazir zığ yerləş modul tipli xəstəxana yanğın ol nəticədə xəstə saat oksigen qal buq iç halı pisləş öl ol
1646,erməni silahlı qüvvə baş qərargah rəis on qa çaylaq istiqamət əsir düş erməni əsgər sak dür geri qaytarılma sülhməramlı danışıq aparıl
1647,türki müdafiə nazirlik qara bölgə minala təmizləmə əməliyyat davam edi türki quru qoşun aid nəfər ibarət mina qrup azərbaycan gəl fəaliyyət başla
1648,azərbaycan nəfər kor yoluq nəfər müalicə olun sağ nəfər vəfat edi
1649,milli məclis plenar iclas inzibati xəta məcəllə dəyişiklik layihə müzakirə çıxarıl vəzifəli şəxs manat hüquqi şəxs manat məbləğ cərimə edilə fiziki şəxs ol ol qal
1650,laçın zəng sərhəd yeni foto sol azərbaycan bayraq sak erməni bayraq tut əsgər ara cəmi metr məsafə
1651,iqtisadiyyat nazik mika cabbarov gözlənilməz ol yeni növ kor pandemiya şərait azərbaycan martı əvvəli indiyədək təxminən min yeni iş yeri açıq açıqlan yeni iş yer faiz çoxu özəl sektor pay düşür
1652,əsir girov qayıdan azərbaycanlı
1653,azərbaycan səhiyyə nazir müavin viktor qa ölkə kor qarşı vaksinasiya pulsuz həyat keçiril artıq risk qrup müəyyənləş növbə vaksinasiya həyat keçiril
1654,nəticədə şəxsi nəzarət altın rusi aerokosm qüvvə təyyarə nəfər bak gətiril azərbaycan səlahiyyətli orqan nümayəndə təhvil veril azərbaycan tərək nəfər erməni qaytar
1655,dağlıq qara rusi sülhməramlı kontingent komandir general rüst murad rusi azərbaycan erməni lider noyabr il tarixli üçtərəfli bəyanat əsasən hamı hamı prinsip əsir mübadilə həyat keçiril
1656,rusi sülhməramlı son yenilən xəritə köhnə taq çaylaq çəkil ərazi azərbaycan ordu ol görsən
1657,covid pandemiya bağlı dəfə bak qapaq dekabr bakda xüsusi karantin rejim tətbiq olun xüsusi icazə olmaya yaşayış yerik gün ərzində yalnız saatlıq tərk e bilək
1658,girov dilqəm əsgər şah qul artıq bak
1659,qəbir meyit üzərində təhqiredici hərəkət şübhəli bilin hərbçi cinayət iş açıq
1660,günü vacib xəbər erməni dekabr dan müharibə itki əlaqədar günlük matəm elan edilə at min qrup həmsədr yer səfər rusi prezident mətbuat katib dmitr peskov narahat edici məqam həll edil
1661,şuşan giriş əvvəlcədən asıl türki bayraq yığışdırıl
1662,azərbaycan erməni tərək azərbaycan işğal azad olun ərazi atəşkəs rejim pozulma müşayiət olun təxribat əməl törət azərbaycan silahlı qüvvə tərəkndən adekvat cavab tədbir görül hal atəşkəs rejim riayət olun
1663,rusi müdafiə dağlıq qara atəşkəs pozul bildir qeyd e erməni müdafiə nazirlik azərbaycan ordu gün çaylaq köhnə taq istiqamət hərbi əməliyyat başla elan edi
1664,azərbaycan gün nəfər kor yoluq nəfər sağ nəfər vəfat edi
1665,bak şəhər ceyh səlimov küçə yerləş yeni metro noyabr lövhə vuruq
1666,azərbaycan nəfər covi yoluq nəfər sağ nəfər vəfat edi
1667,türki tehran səfir de ör iraq xinn çağırıl səbəb türki prezident rəcəb tay er paraq səsləndir şeir
1668,ümumdünya səhiyyə təşkilat azərbaycan milli qızılca laboratoriya göstər xüsusi qayğı diqqət azərbaycan səhiyyə nazik o şirəli təşəkkür edi
1669,prezident er dünən araq çaq bağlı söylə şeir şimal olan torpaqla cənub zorla ayrıl bildiril azərbaycan respublika suveren zərər ver fərq deyil əziz azərbaycan haqqında danış bilməz
1670,irq xarici işlə nazik cavad zərif twitter hesab türki prezident paraq səsləndir bəxtiyar vah torpaq pay olmaz şeir cavab ver
1671,azərbaycan il dekabr si saat dan hərbi vəziyyət ləğv olun barə milli məclis qərar səsvermə çıxarıl qəbul edil
1672,türki xarici işlə nazik mövlud çavuş qardaş ceyh bayram imzala protokok türkiazərbaycan ara yaxında şəxsiyyət vəsiqə səyahət e bil millət iki dövlət yaraq xeyirli olsun
1673,erməni tərək azərbaycanlı əsir saxlanıl bildiril meydan neçə mənbə fakt dəqiqləşdir əsir götürül azərbaycan vətəndaş yalnız n adıq müəyyənləşdir bil
1674,günü foto zəfər parad izlə qazi foto re
1675,kəl erməni düzəlt azərbaycanlı nömrələ ibarət divar yenilən forma hərbi park gətiril
1676,polad hə ilqar mirzə milli qəhrəman adı veril
1677,azərbaycan silahlı qüvvə general z məmmədov qara yerləşdiril rusi sülhməramlı rəhbər general rüst murad görük
1678,səba rayon məhkəmə cəli rayon icra hakimiyyət sabiq başçı nam zey barə müddət həbs qətimkan tədbir seçil
1679,qusar nə meşə ağacla kütləvi qırıq qırıl ağaclaın qusar mavi yanacaq olmaya kənd ətraf rayon bazar qiymət ucuz satıl bildiril ekoaktivist cavid qara ərazi hektarlıq yeni bak salın iddia edi
1680,azərbaycan xarici işlə nazik ceyh bayram iraq səfər edi prezident ha ruhani görük
1681,rusi sülhməramlı qara əsgər rayon ucqar yaşa tibbi heyət gətir rusi müdafiə nazir məlumat görə dan həkim cəlb olun çoxfunksiyalı tibbi briqada tərkib cərrah terapevt epidemioloq psixoloq daxil
1682,azərbaycan gün nəfər kor yoluq nəfər sağ nəfər vəfat edi
1683,rusi baytarlıq fit nəzarət üzrə federal xidməti rosselxoznadzor dekabr dan azərbaycan rusi alma pomidor idxal qadağan edi səbəb həmin məhsul zərərverici aşkarla göstəril
1684,azərbaycan hava yolla mətbuat xidməti bildir yanvar il tarix azərbaycan respublika hava liman müntəzəm sərnişin reys həyat keçirilmə bağlı
1685,müdafiə nazirlik vətən müharibə nəfər şəhid ol gün şəhid dəfn edil dəfn edil şəhid foto şəkil adla soyadla hərbi rütbə doğum tarixi haqqında məlumat təqdim olun
1686,qeyd e dekabr hüquq orqan əməkdaş tərəf cəli rayon icra hakimiyyət inzibati bina əməliyyat keçiril saxlanıl ara icra başçı vaq
1687,ölkə başçı ilham əl sərəncam əsasən nam rəsul o zey cəli rayon icra hakimiyyət başçı vəzifə azad edil vəzifə fevral il təyin edil
1688,bak metro yanvar də işləmə şənbə bazar günlə ictimai nəqliyyat işləmə işlə portal icazə veril
1689,azərbaycan karantin rejim dekabr il yanvar sərtləşdiril sms küçə çıxma icazə müddət saat olacaq restoran kafe çay ev fəaliyyət dayandırıl sıra şəhər rayon giriş dayandırıl
1690,prezident ilham əl dekabr azərbaycan ərazi bütöv müdafiə əlaqədar yaralan şəhid ailə təminat dəstək fond fond yaradılma haqqında fərman imzala
1691,gün il qət keçiril futbol üzrə dünya çempionat avrop zona üzrə seçmə mərhələ püşk atıl azərbaycan milli komanda qrup düş rəqiq port serb ir lüks ol
1692,son su ərzində azərbaycan nəfər covi yoluq nəfər sağ nəfər vəfat edi
1693,milli məclis dekabr keçiril növbəti iclas azərbaycan respublika prezident ilham əl il dekabr saat dan hərbi vəziyyət ləğv olunma haqqında fərman təsdiq edilmə barə milli məclis qərar baxıl
1694,dağlıq qara savaş azərbaycan erməni qoy qadağan ləğv et iki ölkə artıq uefan bayraq altın təşkil olun oyun ev sahiblik e bil
1695,milli məclis deputat ras musabəyov türki hərbçi gəl erməni azərbaycanlı ara durma məna yoq erməni türki hərbçinin olma təhlükəsizlik hissi yarat əksinə
1696,erməni müharibə qurban veril olan sosial dəstək paket açıqla həlak ol hərbçi milyon dram manat veril
1697,azərbaycan infeksiya yeni yoluxma fakt qeyd alıq nəfər sağ nəfər vəfat edi
1698,vətən müharibə şəhid xatirə yad etmə məqsəd sabah dekabr saat ölkə ərazi dəqiqəlik sükut olacaq
1699,müdafiə nazirlik nəfər hərbi qulluqçu həlak ol nəfər artıq hərbi qulluqçu itkin düş hesab olun hazırda nəfər hərbi qulluqçu tibb müəssisə müalicə davam edi
1700,noyabr türki cümhuriyyət qurucu mustaf kamal ata anım günü üst düşmə əlaqədar azərbaycan zəfər günü il noyabr keçiril
1701,azərbaycan tanınmış vəkil adil i vəfat edi kor öl bildiril e adil iun illik vəkil təcrübə ol
1702,erməni media iddia edi girov dilqəm əsgər şah qul test nəticə pozitiv çıx kor yolux hazırda harada müalicə olun dair məlumat veril
1703,ana agentlik qara son durum bağlı xəritə paylaş
1704,erməni hərbi vəziyyət bağlı məhdudiyyət ləğv edil
1705,laçın koridor rusi sülhməramlı nəzarət altın foto ri nov
1706,vladim put rusi qara humanitar fəaliyyət ölkə qoşulma maraqlı
1707,rus sülhməramlı cəsəd erməni tərək təhvil ver ha cəsəd müəyyən edil
1708,mina partlama nəticə erməni hərbçi ölü
1709,şuşay yeni yolun tikinti türk yerli tikinti şirkət cəlb edil
1710,saat olan xəbər kəl komendant polis polkovnik ha ək təyin edil
1711,rusi hərbi nəqliyyat aviasiya dağlıq qara humanitar mərkəzlə təminat dekabr on stepanakert xan hava liman istifadə e bil ətraflı
1712,azərbaycan gün nəfər kor yoluq nəfər sağ nəfər vəfat edi
1713,dekabr azərbaycan prezident ilham əl ölkə zəfər anım günlə təsis edilmə haqqında sərəncam imzala il sentyabr si azərbaycan respublika anım günü noyabr zəfər günü qyed edilə
1714,millət vəkil aydın mirzə new azərbaycanca de şəhid ailə müharibə sağlam itik şəxs ödənil müavinət məbləğ gələn ilin büdcə baxıl bil
1715,eyni zaman müharibə zaman əlillik olan şəxs dərəcə uyğun ol manat təqaüd müəyyən edil deyə qeyd edi
1716,sosial təminat siyasət şöbə müdir bak hüseynov söz şəhid ailə şəxsi şəhid status müəyyən edil gündə aylıq məbləğ manat olan təqaüd alma hüquq
1717,azərbaycan gün nəfər kor yoluq nəfər sağ nəfər vəfat edi
1718,rəsmi azərbaycan ordu bölmə laçın rayon daxil ol
1719,vahid əlaqələndirmə mərkəzlə şəhid ailə üzv qazi müraciət edi ətraflı
1720,həftə
1721,ək əhali sosial müdafiə nazir tabeli dövlət tibbi ekspertiza reabilitasiya agentlik tərəf ilin yanvar ay ərzində şəxs əlillik təyin olun ətraflı
1722,nəfər imtiyazlı şəxs sanatoriya müalicə mərkəzlə yol salıq ətraflı
1723,ilin ayıq pensiya təminat üzrə keçən ilin eyni dövr nisbətən ml manat olma mlrd ml manat ödənil ətraflı
1724,noyabr beynəlxalq göz əlik günü gözəlikgünü
1725,noyabr milli məclis ək sosial siyasət komitə iclas keçiril
1726,gün ək əhali sosial müdafiə nazirlik tərəf bak rama qəsəbə nəfər göz əlillik olan şəxs mənzil veril ətraflı
1727,aparıl sosial islahat müsbət nəticə ək əhali sosial müdafiə nazir tabeli dövlət sosial müdafiə fond gəlir davamlı artım temp imkan ver
1728,öz proqram icra rəqəm platforma yaradıl proqram müraciət edənlər elektron reyestr qiymətləndirmə əsasında növbəlilik prinsip tətbiq edil ətraflı
1729,konstitusiya
1730,tut əlik layihə üzrə gün noyabr saat az yayımlan növbəti veriliş ək əhali sosial müdafiə nazir müavin vüsal nə şəhid rəh hüseynov övlad hikmət rüfət birgə keçir gün təqdim edilə
1731,ilin ayıq pensiya müavinət təqaüd ünvanlı üzrə ötən ilin eyni dövr nisbətən ml manat olma mlrd ml manat vəsait ödənil ətraflı
1732,ək əhali sosial müdafiə nazik sahil baba bolqar ölkə səfir nikol yan görük ol ətraflı
1733,ək əhali sosial müdafiə nazirlik yanında ictimai şura üzv növbəti görüş ol ətraflı
1734,noyabr saat tut layihə növbəti buraxılış az izləmə unutma veriliş iştirakçı şəhid rəh hüseynov övlad hikmət rüfət müavin vüsal nə görüş maraqlı gün keçir şəhid
1735,ək əhali sosial müdafiə nazir ümumdünya səhiyyə təşkilat avrop regional ofis reabilitasiya üzrə regional texniki rəhbər sat mi görüş ol ətraflı
1736,buq il bütöv azərbaycan dalğalan şanlı b günü dövlət bayraq günü mübarək noyabr dövlətbayraqgünü
1737,keçən ilin günü noyabr füzul cəbr laçın qu zəng xoca xoca rayon sıra kənd düşmən işğal azad olun qara müzəffər rəşadətli
1738,məşğul altsistem vakansiya yerləşdir müəyyən edil prioritet iqtisadi sahə üzrə vakansiya olan işəgötürən əməkhaqqı birgə maliyyələşdir proqram linkin daxil ol müraciət e bilək
1739,noyabr həmrəy milli bir təzahür olan dövlət b günü noyabr dövlət
1740,noyabr dövlət
1741,əziz şuş azad əziz şuş qayıt əziz şuş sək dirçəl şuş biz qara biz şuş shush qarabiz
1742,tarixi torpaqla alnıaçıq üzüağ zəfər bayraq qayıt ölü min dik olsun rəşadətli azərbaycan ordu rəşadətliazərbaycanordu qara qara
1743,zəfər günü münasibətilə ək əhali sosial müdafiə nazirlik tərəf vətən daim sülh arzu adlı keçiril aksiya mərkəzlə qarşı sülh rəmzi olan göyərçin səma uçurul anlaq video təqdim edi zəfər zəfər
1744,zəfər günü münasibətilə tərəf vətən daim sülh arzu adlı aksiya keçiril mərkəzi ön sülh əmin rəmzi olan göyərçin səma uçurul ətraflı zəfər qara qara
1745,ötən ilin günü noyabr azərbaycan respublika prezident cənab ilham əl iyirmi səkkiz il yarım işğal altın olan şuş azad edil cümlə azərbaycan son yüz illik tarixi möhtəşəm müjdə ol qara müzəffər şuş
1746,tabeli ək bazarı sosial müdafiə məsələ üzrə milli o azər holdinq az productio mmcn dəstək astar şəhid ailə qazi görüş keçiril şəhid yaradılmış xatirə lövhə ziyarət olun
1747,həftə
1748,post dövr şəhid ailə üzv qazi erməni terror zərər çək şəxs ibarət min şəxs sosial dəstək göstəril
1749,keçən ilin günü noyabr füzul cəbr qu zəng xoca xoca rayon sıra kənd düşmən işğal azad olun qara müzəffər rəşadətli
1750,ək əhali sosial müdafiə nazir müavin hidayət ab zəfər qəhrəman biri şəhid baş leytenant həmi ailə ziyarət edi şəhid uşaq mədin yu mələk görük ətraflı
1751,ək əhali sosial müdafiə nazir keçiril kollegiya iclas cari ilin ayıq görül işlə post dövr sosial dəstək tədbir müzakirə olun ətraflı
1752,azərbaycan
1753,bak su şəhər ab rayon üzrə noyabr ayıq pensiya ödənil bak su şəhər eləcə ab rayon üzrə noyabr ayıq aid pensiyanın ödəniş həyat keçiril
1754,noyabr saat tut əlik layihə növbəti buraxılış az izləmə unutma tutəlik şəhid
1755,öz
1756,media nümayəndə bak reabilitasiya mərkəzi qazi göstəril reabilitasiya sosial xidmət tanış ol ətraflı
1757,ək əhali sosial müdafiə nazik sahil baba azərbaycan uşaq ümumrespublika forum iştirak ed uşaq qrup görük ətraflı
1758,az birgə tut əlik layihə növbəti veriliş şuş istiqamət ge döyüş şəhid ol rövşən nur övlad kən iş mərkəzi direktor firud cəbr görüş maraqlı gün keçirdil şəhid tutəlik
1759,məşğul marafon fəal iştirak e işəgötürən təşəkkürnamə təqdim edil ətraflı
1760,keçən ilin günü noyabr zəng cəbr qu rayon sıra kənd düşmən işğal azad olun qara müzəffər rəşadətli
1761,media nümayəndə qəbə i şəhid ailə qazi yaradılan təsərrüfat tanış ol ətraflı öz media
1762,sabah ab mərkəzi vahid əlaqələndirmə mərkəzi fəaliyyət başla ətraflı
1763,iki şəhid ailə görüş məşğul məsələ həll edil ətraflı
1764,məşğul marafon qoşulma istə işəgötürən vakansiya barə işlə təmin olunma istə şəhid ailə üzv vətən müharibə yaralanmış qəhrəman özlə haqqında məlumat linkin daxil olma qeyd e bilək
1765,vətəndaş
1766,keçən ilin günü noyabr cəbr zəng qu rayon sıra kənd düşmən işğal azad olun qara müzəffər rəşadətli
1767,dövlət uşaq müəssisə uşaq doğma ailə mühit qayıdış nail olunma istiqamət işlək davam ol il uşaq həmin müəssisə ailə qaytarıl ətraflı
1768,həftə
1769,sosial xidmət agent sosial xidmət müəssisə fəaliyyət göstər birik müasir tələb uyğun yaşayış reabilitasiya şərait yaradıl ətraflı
1770,sosial saat oktyabr ayı üzrə qonaqla canlı yayıq vətəndaş maraqlı olan sual cavablandır sosial
1771,sosial təminat növ sosial sığorta ək məşğul əlillik mənzil avtomobil təmin edilmə fərdi şəxsi hesab barə arayış vətəndaş artıq hansı quruma müraciət etmə eqayda ək e bilik ətraflı earayış
1772,keçən ilin günü oktyabr zəng cəbr qu rayon sıra kənd düşmən işğal azad olun qara müzəffər rəşadətli
1773,iraq ölkə repatriasiya olun uşaq si ək əhali sosial müdafiə nazir tabeli sosial xidmət agent nəfər səhiyyə nazir müəssisə yerləşdiril ətraflı
1774,cümhuriyyət ekimcumhuriyetbayra
1775,linked ünvan
1776,mdby üzv dövlət ək məşğul sosial müdafiə üzrə məşvərət şura iclas keçiril ətraflı
1777,ək əhali sosial müdafiə nazirlik az birgə tut əkk layihə növbəti iştirakçı nazirlikn tabeli dövlət məşğul agent sədri mustaf ab şəhid toğr b uşaq ək güllü ol ətraflı
1778,ək əhali sosial müdafiə nazirlik artıq qazi yüksək texnologiyal protezlə təmin edi ətraflı biz tel izlə
1779,ar bak
1780,keçən ilin günü oktyabr zəng füzul cəbr qu rayon sıra kənd düşmən işğal azad olun qara müzəffər rəşadətli
1781,ölkə himayədar ailə institut tətbiq hazırlıq işlək çərçivə müvafiq sahə qardaş türki təcrübə öyrənilmə nəzər tutuq ətraflı
1782,prezident ilham əl imzala oktyabr il tarixli fərman ək əhali sosial müdafiə nazir mərkəzləşdirilmiş elektron informasiya sistem zəfər altsistem yaradıl
1783,sabah saat tut əkk layihə növbəti buraxılış az izləmə unutma veriliş iştirakçı şəhid toğr b övlad ək güllü dövlət məşğul agent sədri mustaf ab maraqlı gün keçir tutəkk
1784,məşğul marafon qoşulma istə işəgötürən vakansiya barə işlə təmin olunma istə şəhid ailə üzv vətən müharibə yaralanmış qəhrəman özlə haqqında məlumat linkin daxil olma qeyd e bilək
1785,ək əhali sosial müdafiə nazir tabeli sosial xidmət agent sədri vüqar behbud vətən müharibə şəhid nicat şahin o səmə il mərasim iştirak edi şəhidn ailə görük ətraflı
1786,ək əhali sosial müdafiə nazir elektron xidmət ilin yanvar ay milyon müraciət qeyd alıq ətraflı
1787,ar bak
1788,ölkə dövlət sosial xidmət sahə i nailiyyət olan konsepsiya azərbaycan yeni b beynəlxalq arena böyük maraqla qarşılan ətraflı
1789,vətəndaş
1790,az birgə tut əkk layihə növbəti veriliş su istiqamət ge döyüş şəhid ol toğr b övlad ək güllü sədri mustaf ab görüş maraqlı gün keçirdil şəhid tutəkk
1791,il yaxın əlillik olan şəxs öz proqram cəlb edil ətraflı öz
1792,bir bir
1793,ək əhali sosial müdafiə nazir portal qeydiyyat keçən aktiv istifadəçi sak ilin ayıq artma davam edər oktyabr min çaq ətraflı esosial
1794,ək əhali sosial müdafiə nazirlik tərəf bak xoca qəsəbə şəhid ailə müharibə əlil göz əlillik olan şəxs dövlət uşaq müəssisə məzun mənzil təqdim edil ətraflı
1795,ək əhali sosial müdafiə nazik sahil baba vahid əlaqələndirmə mərkəzi ol qrup şəhid ailə üzv qazi görük ətraflı və
1796,sosial
1797,birinci vitse mehriban əl təşəbbüs bak yaradılan geniş çox fəaliyyət sahə əhatə e i inkişaf yaradıcılıq mərkəzi media təşkil olun ətraflı
1798,keçən ilin günü oktyabr qu şəhər qu cəbr zəng rayon sıra kənd düşmən işğal azad olun qara müzəffər rəşadətli
1799,il oktyabr illik həsrət son qoyul qu şəhər rəşadətli ordu tərəf düşmən tapda azad edil qu biz qara azərbaycan qaraazərbaycan müzəffər rəşadətli
1800,həftə
1801,rəşadətli
1802,ilin ayıq ək əhali sosial müdafiə nazirlik qurumla mində vətəndaş qəbul edil ətraflı vətəndaş
1803,keçən ilin günü oktyabr xoca cəbr zəng qu rayon sıra kənd düşmən işğal azad olun qara müzəffər rəşadətli
1804,azərbaycan respublika prezident ilham əl birinci xanım mehriban əla qız leq əla oktyabr bak i inkişaf yaradıcılıq mərkəzi açılış iştirak edi
1805,azərbaycan respublika prezident ilham əl birinci xanım mehriban əla qız leq əla oktyabr bak i inkişaf yaradıcılıq mərkəzi açılış iştirak edi
1806,vahid əlaqələndirmə mərkəzlə dən şəhid ailə üzv qazi müraciət edi ətraflı
1807,keçən ilin günü oktyabr füzul cəbr zəng rayon sıra kənd ağ qəsəbə düşmən işğal azad olun qara müzəffər rəşadətli
1808,sosial
1809,ək əhali sosial müdafiə nazir tabeli dövlət tibbi ekspertiza reabilitasiya agentlik fond ara əkdaşlığa dair memorandum imzalan ətraflı yaşatfond
1810,keçən ilin günü oktyabr füzul cəbr zəng rayon sıra kənd düşmən işğal azad olun qara müzəffər rəşadətli
1811,azərbaycan respublika prezident ilham əl birinci xanım mehriban əla zəng rayon səfər ol
1812,vətən müharibə əlil daxil olma nəfər sanatoriya müalicə mərkəzlə yol salıq ətraflı biz tel səhifə izlə
1813,ək əhali sosial müdafiə nazirlik tərəf şəhid ailə müharibə əlil göz əlillik olan şəxs mənzil təqdim edil ətraflı biz tel səhifə izlə
1814,sosial zəng
1815,cəbhə vətən iş baş vətəndaş xidmət edən ətraflı qara biz
1816,energetik
1817,amerikalı jurnalist de fen myanma hakim hərbi xunta tərəf irəli sürül ittiham il həbs cəza məhkum edil neçə gün həbsxana azad edil
1818,yayılan məlumat keçmiş kök z dinamo avstriyan ad vakker komanda məşqçi olan z sol irq azərbaycan populyar traktor komanda yeni baş məşqçi ol təyin edil
1819,azərbaycan gömrükçü kq heroin dövriyyə qarşı alı barə dövlət gömrük komitə sədri səfər meh twitter səhifə məlumat ver
1820,noyabr dən başla ab səfər etmə peyvənd olunma mütləq
1821,gün noyabr b şəhər işgüzar səfəri çərçivə azərbaycan xarici işlə nazik ceyh bayram naton mənzil baş katib müavin mir ceoan görük
1822,son günlə azərbaycan sərhəd gərginlik artan xət inkişaf etmə iki ölkə rəsmi qurumla qarşılıqlı atışma barə məlumat yayma davam edi
1823,b polis bazar günü liver şəhər xəstəxana qarşı avtomobil partlama nəticə nəfər ölü digər yaralan bildirmə terror qanun çərçivə nəfər həbs edil barə məlumat ver
1824,rusi cümə günü mi böhran baş ver bel polk sərhəd bölgə hərbi paraşütçü dəstələ göndər
1825,əfqan talib rəsmi cümə günü günorta namaz vaxt şərqi nan vilayəti izdihamlı məscid bomba partlama nəticə azı ibadətçi yaralan bildir
1826,gürcü həbs olan keçmiş prezident saakaşvilin yüz tərəfdar mitinq keçirmə paytaxt toplaş mitinq iştirakçı aclıq aksiya səhhət pisləş siyasətçi mülki tibbi klinika köçürülmə tələb edi
1827,azərbaycan ali məhkəmə plenum vəkil kollegiya iddia üzrə aslan i vəkillik uzaqlaşdır barə yerli məhkəmə çıxar qərar ləğv edi
1828,prezident co b çin lider ş tsinpin regional ticarət geosiyasi gərginlik artma fon cümə günü sakit okean hövzə lider müraciət edəcəklər gözlənil
1829,azərbaycan son su kor infeksiya yeni yoluxma fakt qeyd alıq nəfər müalicə olun sağ
1830,birləşmiş ştat b təhlükəsizlik şura avropalı üzv polşabelaru sərhəd gərginlik art vaxt bel mi rüsvayçı alət istifadə etmə günahlandır
