,Text
0,kərə yüksələn bayraq enmə bayraq günü mübarək
1,zəfər günü mübarək
2,rəssam
3,ocaq közər sön günlə geri dönə qəm eləmə kö dənə dünya qara daşı göyərmə
4,son başlanğıc günü torpaq qaytar özlə qayıtma il
5,xəyal dağ araq göy yüksək en insan otaq saat tək oturaq ilin dərd yüklən insan bəxtiyar vah
6,mika təkcə adı düş
7,təkcə adı düş
8,mika zaman dön ol b vah
9,zaman dön ol b vah
10,mika oxşa göz hələ uşaq ocaq al alov kök dünya gəl bil nədən nə vurul yandır biz
11,oxşa göz hələ uşaq ocaq al alov kök dünya gəl bil nədən nə vurul yandır biz bəxtiyar vah
12,tale oyunu cütlə zər yüz il qoşa atıl qoşa düşmə
13,kəs bil həyat son ölüm ah qəmli dəyişmə yaman z şеr gülünc oyun bəlli yarın biz bəklə öl fəqət məzar olsun ürək
14,helpturke
15,prayforturke
16,gedire axşam gedik gül bilik gül üz sol mən gedik gəlmə qalac sevgi gözlə dok mən pir dilənçi
17,qurban bayram mübarək
18,mika bol ol meyvə bol ol barı əyil budaq ibrət götür baş dik tut ədabaz daim öz aşağı görk
19,bol ol meyvə bol ol barı əyil budaq ibrət götür baş dik tut ədabaz daim öz aşağı gör
20,de sevil insan demə zaman sevmə ol nüsrət kəsə
21,min il əvvəl gəl bil min il öl bil zaman başqa cür hesabla vaxt başqa cürə böl bil düş dok həftə aya sək sevmə gəl dünya zəli yak
22,çox dünya yük sevgi yük nifrət yük görüş söhbət yük ayrıla həsrət yük ram rövşən
23,yarpaq titrək bil səs pıçılda ol əzik olma bəs varlı sağ ol əzik
24,un fikir təkcə unutma ürək sev öz unut dedikcə öz un tap sək
25,vətənçi yaşa vətənçi öl səmimi insan bəxtiyar
26,kö de hələ buq nə böyük günlə şanlı günlə şən günlə yoluq düş günlə hələ qarşı
27,kəs ulduz deyə demi həyat şirin zay demi
28,sevgili əy yaşıl geyin sallanış sərv kimi bənzətmə üzdən ol tamaşa görkəm səmə kimi
29,dünya qaynar qazaq demə söndürmə odun qar yağış dünya dalaşma asan demə çətin dünya barışma
30,göz yaş çıxar ürək yanma
31,çiçək məftun bülbül gözlə bağça gül düş qəhr çək gül surət xəyal sakit göl düş
32,mən gözəl xatırla fərz et külək
33,mika əbd o i mika müşfiq iyun il dünya gəl illik ömrün unudulmaz şeir yazan şair il repressiya qurban ol il vəfat et
34,kəs qəm duçar ol ağlar ağlama ənduh qus yarı ol ağlar ağlama
35,yaşa ey şanlı azərbaycan may
36,yenə bağ olay sək tez görə
37,zaman gözəl əsər hansı
38,xar içində bit qönçə gül minnət eyləmə ərəbi fa bilmə dilə minnət eyləmə sirat müstəqim üzrə izlə rahi iblis təlim et yol minnət eyləmə qul nəsim
39,kaş yenə müşfiq yak olay şirin nəğməli sak olay istə bağ olay günorta alış torpaq olay bir nəsim yay mavi xəzər dilsiz axşamla göy
40,ocaq közər sön günlə geri dönə qəm eləmə kö dənə dünya qara daşı göyərmə mus yak
41,on çırpıq qol on yek deyil göy ara gör bədbəxt axır adı xırda uşaq dilik düş
42,sağım adaq dolu qol kişi qadın keçir öz xəbərsiz ömrün min yol öz öldür adaqr keçir
43,ad il aprel tarixi fərd qədir adlı şəxs ad korpus daxil ol makarov tipli tapan qarşı çıxan şəxs atəş aç terror akt nəfər ölü nəfər xəsarət alı
44,cahil cəmiyyət seçim etmə oxuma yazma bilmə birik ha kitab oxu soruşma axma hərəkət nietzsche
45,insan namuslu namussuz ol iki yek ayrıl buq orta yox çex
46,yaşa yeri cənnət etmə müddətcə qaç yer cəhənnəm
47,xoşbəxt olma alma hazırlaş icazə ver çərpələng uçur
48,yanlış görək yanlış bilək yalnız düşün vaxt yanlış hiss etmə
49,sərt ol dalğa qaya çarp geri dönər yolla kəsik intizar sənsiz qalan sevgi ümid dilə
50,dahilik axmaqlıq ara fərq dahilik sərhəd olma al einste
51,dindar tanrı göstər insan lazım friedrich nietzsche
52,insan sev bil sevmə başlama can yücel
53,üzüntü saxta olan ağlama göstəriş ol tol
54,ha söz qoş aya ulduz ha deyim gecə gözəl gecə gecə üz tut öz bilik kef necə
55,hiss etmə şey anlaq bilməz uily şeksp
56,cəmiyyət həqiqət uzaqlaş həqiqət deyən nifrət ed george o
57,qanadsız quş xülq şeir
58,kitab insan küçə sev cem mer
59,gün ağız qal boş gün dolu dad ol gün olmaz gün ol bəxt dur görək yak qohum ol bəxt yataq qohum yad ol
60,heyvan insan zalım ol bilməz cür ustalıqla zalımlıq insan bacaq dost
61,həyat öncə öz görmə gəl başqa çırpın sınaq çək
62,kəs bil həyat son ölüm ah qəmli dəyişmə yaman z şеr gülünc oyun bəlli yarın biz bəklə öl fəqət məzar olsun ürək
63,mart aprel tarix bolşevik dəstək daşnak partiya baş stepa şaumyan dur erməni birləşmə milli təmizləmə siyasət apar bak şam qu ərazi minlərlə türk əhali qarşı qırğın törət
64,mart qan yaddaş
65,de sevmə rəna gözəl bil sevgi aləm biixtiyar əl vahid
66,tanı insan oxu kitab həyat dəyişdir
67,dözülməz olan bəzən həyat yox insan frank kafk
68,boş insan iç dolu xəyal qura bilməz bu
69,təhlükəli insan tik anlaq inan çex
70,dünya işlək bil ağır cinayət iş insan həyat sevinc ümid öldürmə george o
71,qəlbi həssas olan dünya ağır gəlir cahit zar
72,bas yer top di geçme tanı düşün altın b kef yataq can
73,cahan к solmayan bağça rəva gülmə ölmə yazıq şəхs к qaraqabaq yaraq insan gülmə
74,arzu bax sevgili tellə incə söylə ürəyincə
75,vicdan olmaya yaxşılıq ol bilmə insan əzab çək bilməz khaled hossein
76,susqun insan boş divar kimi arxa nəsə ol bilik on yıxma cəsarət et
77,gəl istək gəl bil ək de dil deyə bil nəbi xəzri
78,xarici ədəbiyyat sevin cümlə yazın
79,mart
80,dünya yarı qadın ibarət yarı qadın dünya gətir bayram mübarək əziz xanım
81,təsadüfi yek çiçək qoy qadın məzar rast qadın öldürül ölkə
82,ruh qarşı baş əyir ulu öndər
83,daş qəlb insan ney ilahi biz soyuq qan ney ilahi mirzə ələk sak
84,qadın ha kibrit çöpük tez sök gülüş
85,uşaq bil sev bil bəzən şair dəlil bil bizlə möcüzə dolu dünya bil o
86,gecələ dara saçla gözəl gözək gözəl
87,qorxu dünya zaman gəl insan yaşa insanlıq öl
88,yad məhəbbət dəniz duyğu duyğu təmiz baba vəzir
89,kho
90,xoca soyqırımı anım günü xocanın öz kho
91,qadın gül işsiz mühit gül sürüklən bəşəriyyət qadın yüksək hüsey cavid
92,sək yuxu duru öz uşaq ev öl sağ
93,followsilentl ekskalib necmeddinsadygv qemlo
94,rəsul de qadın aciz haqla məhrum cahil deməli millət yarı xəstə iflic durum
95,vaxt rast gəl hal gülmə istə vaxt rast gəl təzədən dünya gəlmə istə
96,yenə şəhər üzük gəl ney ayrıca şəhər yox xoşbəxt ol bil xoşbəxt xəbər yox
97,görün ol əlik al dəniz su mavi ol george o
98,gün dahi qəzəlxan doğum günü
99,qax rayon polis şöbə təşkilatçılıq rayon qum kənd tam orta məktəbi narkomaniya yox deyək mövzu maarifləndirmə tədbir keçiril
100,ab rayon taksi sürücü daşla vur qarşı quldurluq e müştəri saxlanıl
101,vətən müharibə azərbaycan ərazi bütövlük uğrunda ge döyüş şəhid ol dik daxili qoşun hərbi qulluqçu baş çavuş i qəsəbov il mərasim keçiril
102,nəsim rayon polis idarə təşkilatçılıq bak slavyan universitet nəzdində məktəbli kompleks karantin qayda nəzər alınma narkomaniya fəsad bəhs e maar tədbir keçiril
103,azərbaycan respublika baş prokuroluğ daxili işlə nazir birgə məlumat
104,işğal azad edil ərazi polis əməkdaş tərəf silah aşkar edilmə məqsəd profilaktik tədbir davam etdiril
105,sabirabad rayon polis şöbə təşkilatçılıq məs adına saylı tam orta məktəb karantin tələb nəzər alınma narkomaniya fəsad bəhs e maar mövzu tədbir keçiril
106,ilin əvvəli polis əməkdaş tərəf yek təkin qanunsuz istifadə cümlə qeyri qum daşınma qarşı alınma istiqamət keçiril reyd zaman fakt aşkar edil
107,sabunçu rayon ev min manat dəyər qızıl əşya oğurla həmçinin narkotik vasitə qanunsuz dövriyyə məşğul olan ümumilik nəfər saxlanıl
108,qara rayon si şəhid ailə olma ev kom aparat oğurla nəfər saxlanıl
109,noyabr azərbaycan respublika konstitusiya günü müstəqil azərbaycan ulu öndər hey əl rəhbərlik hazırlan konstitusiya il noyabr keçiril ümumxalq səsvermə referendum yoq qəbul edil noyabr konstitusiya
110,il noyabr ayıq daxili işlə orqan tərəf qeyd alıq cinayət hadisə haqqında statistik məlumat
111,noyabr daxili işlə nazir qida təhlükəsizlik agent iqtisadiyyat nazirlik yanında dövlət vergi xidməti nümayəndə bak şəhər respublika ərazi toy şən monitorinq həyat keçir
112,baş narkotik mübarizə idarə ölkə keçir növbəti əməliyyat zaman narkotik satış həyat keçir mütəşəkkil dəstək daxil olan nəfər saxlanıl kiloqram narkotik vasitə aşkar edil
113,astar narkomaniya qarşı maarifləndirmə tədbir keçiril
114,qobustan rayon polis təhsil şöbə birgə təşkilatçılıq şəhər saylı tam orta məktəb narkomaniya yox deyək mövzu tədbir keçiril
115,nər rayon narkotik vasitə qanunsuz dövriyyə qarşı son həftə ərzində keçiril əməliyyat zaman nəfər saxlanıl
116,ye rayon polis şöbə təşkilatçılıq rayon saylı tam orta məktəbi karantin tələb nəzər alınma narkomaniya qarşı maarifləndirmə tədbir keçiril tədbir polis əməkdaş məktəbi müəllim şagird kollektiv iştirak edi
117,bak beynəlxalq nar daxil olan norkokuryer saxlanıl
118,hərəkət olan bak elektrik qatar daş ata vaqon şüşlərin sındır sərnişin həyat real təhlükə yaradan azyaşlı saxlanıl
119,b qürur mənbə b can ü gün azərbaycan yerində azərbaycan bayraq dalğalan müzəffər ali baş komandan ilham əl
120,şək şəhər rpşin əməkdaş zəfər günü əlaqədar şəhid xiyaban ziyarət edi şəhidimizin məzar ön gül dəstələ qoy hey əl mərkəzi ərazi zəfər günü həsr olun ağac aksiya polis əməkdaş fəal iştirak edi
121,zərdab rayon polis şöbə zəfər günü münasibətilə vətən müharibə qazi görüş keçiril
122,z zəfər günü əlaqədar rayon ərazi keçiril ağac aksiya polis şöbə əməkdaş fəal iştirak edi
123,oğuz rpşn əməkdaş noyabr günü əlaqədar rayon şəhid xiyaban ziyarət edi vətən bütövlük uğrunda can qurban ver mərd mübariz məzar üzəri tər çiçək düzü əziz xatirə dərin ehtiramla yad edilər
124,azərbaycan respublika prezident ilham əl noyabr türki respublika milli müdafiə nazik hulu akar başçılıq et nümayəndə heyət qəbul edi
125,bil zəfər günü həsr olun ağac kampaniya keçiril
126,heyət
127,il noyabr ayıq daxili işlə orqan tərəf qeyd alıq cinayət hadisə haqqında statistik məlumat
128,erməni hərbi birləşmə şuş şəhər ərazi at qaçma məcbur ol silah sursat təmizlənmə şuş rayon polis şöbə əməkdaş tərəf aidiyyət qurumla birgə nəzarət tədbir görük
129,azərbaycan xalqı lider müzəffər ali baş komandan cənab ilham əl ətraf sıx birləş dünya güc mətin mübariz nümayiş etdir daxili işlə orqan kollektiv adıq zəfər günü münasibətilə xalqı təbrik edi
130,dik daxil qoşun hərbi qulluqçu o baba vətən müharibə torpaqla işğal azad edilmə uğrunda ge döyüş şəhid olma il ötür dik astar rpşn əməkdaş şəhid ailə ziyarət edi
131,ağca rpşn əməkdaş vətən ərazi bütövlük uğrunda sinə sipər et şəhid ailə baş çək onlarla həmsöhbət ol mənəvi dəstəklə ifadə edi zəfər günü münasibətilə şəhid ailə üzv təbrik edi
132,oğuz rpşn əməkdaş noyabr günü əlaqədar rayon şəhid xiyaban ziyarət edi vətən bütövlük uğrunda can qurban ver mərd mübariz məzar üzəri tər çiçək düzü xatirə dərin ehtiramla yad edilər
133,bak polis ictimai nəqliyyat cibgirlik məşğul olan şəxs qarşı əməliyyat keçir cibgir saxlanıl
134,b rayon polis şöbə təşkilatçılıq saylı tam orta məktəb karantin tələb nəzər alınma narkomaniya fəsad bəhs e maar tədbir keçiril
135,sur rayon narkotik vasitə qanunsuz dövriyyə əllə saxlanıl odlu silah aşkar olunma həmçinin oğurluq e şəxs qarşı son gün ərzində keçiril əməliyyat zaman nəfər saxlanıl
136,il noyabr ayıq daxili işlə orqan tərəf qeyd alıq cinayət hadisə haqqında statistik məlumat
137,noyabr daxili işlə nazir qida təhlükəsizlik agent iqtisadiyyat nazirlik yanında dövlət vergi xidməti nümayəndə bak şəhər respublika ərazi toy şən monitorinq həyat keçir
138,bak polis yayınma mütəmadi ol yaşayış ünvan dəyişən nar saxlanıl
139,bak taksi sürücü adı altın nar e şəxs kiloqram artıq narkotik vasitə aşkar edil
140,polis orqan tərəf sanitariya qayda pozulma hal qarşı alınma məqsəd tədbir davam etdiril
141,binə rayon mağaza oğurluq e on yolla narkotik vasitə satış məşğul olan şəxs saxlanıl
142,sabunçu rayon millik ödəmə termin min manat dollar oğurla şəxs saxlanıl
143,noyabr daxili işlə nazir qida təhlükəsizlik agent iqtisadiyyat nazirlik yanında dövlət vergi xidməti nümayəndə bak şəhər respublika ərazi toy şən monitorinq həyat keçir
144,il noyabr ayıq daxili işlə orqan tərəf qeyd alıq cinayət hadisə haqqında statistik məlumat
145,şəhid hərbi qulluqçu mükafat ailə təqdim olun
146,su keç toy məclis vaksin olunma iştirak etmə istə nəfər aşkar edilə geri qaytarıl nəfər aktiv kor xəstə toy iştirak etmə qarşı alıq
147,polis orqan tərəf sanitariya qayda pozulma hal qarşı alınma məqsəd tədbir davam etdiril
148,bil qəsəbə ev kom aparat oğurla şəxs saxlanıl
149,vətən müharibə şəhid olan dik daxili qoşun hərbi qulluqçu çavuş el qul xatirə füzul rayon qara kəndi bulaq tikili
150,nəsim rayon nar avtomobil şüşə sındır oğurluq e ümumilik nəfər saxlanıl
151,il noyabr ayıq daxili işlə orqan tərəf qeyd alıq cinayət hadisə haqqında statistik məlumat
152,noyabr daxili işlə nazir qida təhlükəsizlik agent iqtisadiyyat nazirlik yanında dövlət vergi xidməti nümayəndə bak şəhər respublika ərazi toy şən monitorinq həyat keçir
153,ab rayon xarici ölkə vətəndaş qarşı soyğunçuluq e taksi sürücü saxlanıl
154,noyabr daxili işlə nazik general vilayət ey iştirak respublika şəhər rayon polis orqan sıravi kiçik rəis heyət vəzifə xidmət etmə arzu olan gənc növbəti sıra baxış keçiril
155,sabunçu rayon polis genişmiqyaslı əməliyyat keçir son ay rayon ərazi narkotik qanunsuz dövriyyə məşğul olan oğurluq e nəfər saxlanıl
156,il noyabr ayıq daxili işlə orqan tərəf qeyd alıq cinayət hadisə haqqında statistik məlumat
157,dik dqn xüsusi təyinat dəstə gizir sər ab yaşın tamam olma münasibət doğul qazax rayon xatirə əbədiləşdiril qazax rayon pşn əməkdaş tərəf şəhid adına bulaq kompleks inşa etdiril
158,bil rayon polis şöbə əməkdaş keçir növbəti əməliyyat tədbir nəticə ümumilik kiloqram artıq narkotik vasitə psix maddə narkotik tərkibli həb aşkarla qanunsuz dövriyyə çıxarıl
159,paytaxt səba rayon keçiril əməliyyat zaman narkotik satış məşğul olan nəfər saxlanıl kiloqram artıq narkotik vasitə aşkar edil
160,il noyabr ayıq daxili işlə orqan tərəf qeyd alıq cinayət hadisə haqqında statistik məlumat
161,noyabr daxili işlə nazir qida təhlükəsizlik agent iqtisadiyyat nazirlik yanında dövlət vergi xidməti nümayəndə bak şəhər respublika ərazi toy şən monitorinq həyat keçir
162,paytaxt nizami rayon keçiril əməliyyat zaman narkotik satış məşğul olan qadın olma nəfər saxlanıl
163,bak dəmir yoq xətti oğurluq e şəxs saxlanıl
164,oktyabr tarix daxili işlə nazir qida təhlükəsizlik agent iqtisadiyyat nazirlik yanında dövlət vergi xidməti nümayəndə bak şəhər respublika ərazi toy şən monitorinq həyat keçir
165,baş mütəşəkkil cinayətkarlıq mübarizə idarə əməkdaş b rayon əməliyyat keçir
166,il oktyabr ayıq daxili işlə orqan tərəf qeyd alıq cinayət hadisə haqqında statistik məlumat
167,sağlam həyat tərz təbliğ etmə biri vətəndaşlıq borc
168,il oktyabr ayıq daxili işlə orqan tərəf qeyd alıq cinayət hadisə haqqında statistik məlumat
169,xəta rayon yerləş ticarət mərkəzlə birik oğurluq e şəxs mühafizə polis tərəf saxlanıl
170,nər rayon gənc ara narkotik vasitə satış təşkil e öz bat qələm ver nar saxlanıl
171,i sosial şəbəkə leykoz xəstəliyi əziyyət çək uşaq şəkil paylaş yardım istə edilə yardım şəxsi ehtiyac xərclə şəxs saxlanıl
172,polis əməkdaş tərəf ölkə miqyas qapalı məkan ictimai nəqliyyat reyd keçiril nəzarət tədbir mülki geyimli polis əməkdaş cəlb edil
173,vətəndaş bank kart məlumat ələ keçir hesabla oğurluq e virtual məkan öz arsenik təqdim e ki saxlanıl
174,milli hematologiya transfuziologiy mərkəzi qan bank bölmə təşkilatçılıq nəqliyyat baş polis idarə dəmir yoq nəqliyyat polis idarə növbəti qanvermə aksiya keçiril
175,baş narkotik mübarizə idarə keçir növbəti əməliyyat zaman narkotik satış həyat keçir şəbəkə daxil olan qadın olma nəfər saxlanıl kiloqram artıq narkotik vasitə aşkar edil
176,il oktyabr ayıq daxili işlə orqan tərəf qeyd alıq cinayət hadisə haqqında statistik məlumat
177,oktyabr daxili işlə nazir qida təhlükəsizlik agent iqtisadiyyat nazirlik yanında dövlət vergi xidməti nümayəndə bak şəhər respublika ərazi toy şən monitorinq həyat keçir
178,şəhid polkovnik bak səmidlin adıq saxta səhifə açar insan pul tələb e şəxs müəyyən edilə saxlanıl
179,il oktyabr ayıq daxili işlə orqan tərəf qeyd alıq cinayət hadisə haqqında statistik məlumat
180,oktyabr daxili işlə nazir qida təhlükəsizlik agent iqtisadiyyat nazirlik yanında dövlət vergi xidməti nümayəndə bak şəhər respublika ərazi toy şən monitorinq həyat keçir
181,sosial media üzərində edilə ki bağlı vətəndaş diqqətli olma çağır aşağı qeyd edilələrə riayət etmə ümumiyyətlə internet resurs ayıq olma xahiş edi
182,il oktyabr ayıq daxili işlə orqan tərəf qeyd alıq cinayət hadisə haqqında statistik məlumat
183,oktyabr daxili işlə nazir qida təhlükəsizlik agent iqtisadiyyat nazirlik yanında dövlət vergi xidməti nümayəndə bak şəhər respublika ərazi toy şən monitorinq həyat keçir
184,azərbaycan respublika biznes mühit beynəlxalq reytinq üzrə komissiya cinayətkarlıq mübarizə bağlı xərclə üzrə işçi qrup növbəti iclas keçiril
185,il oktyabr ayıq daxili işlə orqan tərəf qeyd alıq cinayət hadisə haqqında statistik məlumat
186,yasamal rayon son gündə narkotik vasitə qanunsuz dövriyyə məşğul olan nəfər saxlanıl
187,nər rayon avtomobil oğurluq e şəxs saxlanıl
188,il oktyabr ayıq daxili işlə orqan tərəf qeyd alıq cinayət hadisə haqqında statistik məlumat
189,ötən gün ərzində toy şən monitorinq həyat keçiril
190,oktyabr tarix daxili işlə nazir qida təhlükəsizlik agent iqtisadiyyat nazirlik yanında dövlət vergi xidməti nümayəndə bak şəhər respublika ərazi toy şən monitorinq həyat keçir
191,ötən il sentyabr silahlı qüvvə əks başla gün davam e vətən müharibə tarixi əbədi yaşa zəfər nəticələn xalqı yaxın müddət işğal qalan torpaqla azad edilmə sevinc yaşa
192,vətən müharibə azərbaycan ərazi bütövlük uğrunda ge döyüş şəhid ol daxili qoşun hərbi qulluqçu baş çavuş em fətəliyev il mərasim keçiril
193,ölkə daxili işlə orqan tərəf kor pandemiya geniş yayılma törə bil ağır fəsad qarşı alınma məqsəd nəzarət tədbir davam etdiril
194,covid pasport saxta yolla ək etmə çalış iş gəlir mənbə istifadə e şəxs saxlanıl
195,oktyabr daxili işlə nazir qida təhlükəsizlik agent iqtisadiyyat nazirlik yanında dövlət vergi xidməti nümayəndə bak şəhər respublika ərazi toy şən monitorinq həyat keçir
196,kor infeksiya kütləvi yayılma qarşı alınma məqsəd bil rayon ərazi gücləndir nəzarət tədbir davam etdiril
197,savadlı söz yazıq soxma ayrı savad tələb edi
198,sev yaxşı nifrət et pis mən
199,gün icazə ver aşı hüdudla buyur əzik aş at blok mən
200,səfa evlən xeyirli nə olsun boşan mən
201,ana video bak son de öz evlən imkan ver camaat xoşbəxt olsun mən hə
202,sək sev əla bazar baxım esl cto gəl mən
203,şey uçur külək sək yanıma ata bil kaş qəşəng
204,küçə gələn fişəng səslə səksəndir gün ana divar şəkk bak o buq qorxulu sək eşit düşük gur səs eşit o xatırla ömür ana mandal sefameh
205,bilik itir yoq mən ged çat yek başqası otur mən sefameh
206,qara təbrik edi gün olsun ata ev ər ev qrup düş qəşəng mən
207,nikah qeyd alınma dövlət rüsum manat manat qaldırıl vaxtında evlən az qabaq qəşəng
208,hal bəzək getmə ehtiyac yoq göz zaman balqabaq mən
209,yaşlı qızın zorlan dünya ədalət gözlə öz sək al gün başla gecə sabah düzək deyə yuxu gedird milyon yanıl milyon üzül pis yenə gecəgündüz ümid öl lənət gəl dünya mən
210,yağış damla insan hərəm yağış damla kimi bəziləri kimi baka düş bəziləri aya kim bak üstündə ev apar kim küçə orta palçıq ata mən sefameh
211,bəy xanım şahzadə davran demə on kraliça böyük mövzu kimi şahzadə kimi dilənçi doğulma deyil mövzu münasibət mən sefameh
212,zaman pis diləmə zatən həyat gir gözəl şey əllə məhv elə məhv demi yaxşı narahat olma narahat demi hava soyu əy qalın et soyuq demi sonuncu söz çıx ağlıq ağıl demi mən
213,müsl gursəs deyil anlaşılan alış sənsiz olmaz mən
214,maraqlı səhər göz açılma oyaq gün başlama kimi fikir əsas qulaq as mən
215,öz özü mühakimə et çətin bud özü mühakimə etmə başqa mühakimə etmədən qat çətin özü ədalətlə mühakimə e bil deməli həqiqətən müdr adaq ekzüper balaca şahzadə
216,ip alan tarif şura qazın qiymət qaldır olan and işlə ol mən
217,gecə saat di indi mən sök yatacaq vaxt başla sək oyaq yenidən sev gecə xeyrə qal mən
218,nur sərinlən deyil ü sıxıntı dünən gün axtar sək darıx mən
219,el seyid deyil ək dal ək qaba mən
220,tin uşaq deyil kip bax qaş kül ol baş olsun olsun mən
221,flora kərim deyil yer üzük it var gəl taq qapa mən mən
222,ey ya deyil yuxu gəlmə tək sək fikirləş yak əzik mən
223,xanım yak səfa bəy dünənki video ana göstər de gicə baş qoşma evlənmə lazım buq həmin xak ana səslən gic deyil mən
224,gecələ bəyaz olmaya yek cənnət olsun səyyad əl rip
225,yeni qayda kinoteatr yalnız ailəvi gələn şəxs yanaşı otur bil heç olmaz avtobus yan ağız oturrıq üzülmə qəşəng mən
226,əfəndi yarın müzəffər ordu gün haqq olan geri qaytar yak azərbaycan əsgəri as bayraq əfəndi sentyabr müzəffər hərə şəhid sefameh
227,teatr kinoteatr açılma böyük sevinc gətirmə ətraf oyuq rol gir adaq çoxüzlü adaq görük sefameh mən
228,oktyabr dən teatr kinoteatr fəaliyyət bərpa edil gün olsun ana gəl biz teatr çıxar ata hansı film bak adıq danış qəşəng mən
229,vaxtında evlən sabah uşaq duru məktəb apar deyə mübahisə edi qəşəng
230,tədris günü ata xeyir alma şəhid balala azərbaycan dua siz yeni tədris ilk mübarək olsun sefameh
231,bağışlama biz üz bəy
232,milli musiqi günü mübarək
233,video birik de həzrət ək de kişi qızıl haram kişi qızılı yoldaş nəfər şərh yak yanında ol hə məndəkyəm
234,üzül olan haqlı olma məna qal haqlı deyil xoşbəxt olma çalış xoşbəxtlik haqlı xoşbəxt adaq haçan haqlı çıxma əl üz mən haqlı
235,səki qız bak i kəşf düş mən
236,vaksin kimi sevgili sənsiz yaşama mümkün görsən mümkün mən
237,qismət olma istə təbii əsas dəfə se xanım mən
238,hamam olan ged başqa b like edi mən like görüm mən like görüm kim mən bu
239,sentyabr dən qız ev elçilik gələn oğlan ev covid pasport göstərmə mən
240,adaq evlən doğrudan pis deyil evlilik yoxsa deyil mən
241,münasibət mes bar illərlə birlikdə yürü əziyyət çək son hansı xala uşaq psj qismət ol mən mes mespsg
242,ü deyil ayaqla yaralı sevgi yek qırıq qal qalğı yek mən sefameh
243,kəs dava ed önəmli olan davala haqlı çıxma deyil xoşbəxt çıxmadı mən sefameh
244,türki qardaş deyil öz sevinc sevincmiz acı acı tuerkiyeyanıyor acınızacı prayforturke
245,chelove pak gəl qal qəşəng mən
246,trek tos zəng yaraq mən
247,yeni ailə qura cütlük xoşbəxt olun demə istə de xoşbəxt olun ü dərin yazıq gəlir ürək ağrı günlə asan xidmət yoq düşür yeniyetmə uşaq görük nigah gələn məktəbi bitik dünya gəzin mebel dükan deyil
248,gün magistr qəbul alan kəs bak sağ olsun mən
249,bəhanə azal təzyiq çoxal hava sıxlaş ev gərginlik beyin sual kaset qız şəkil oğlaq ana narahat ata əsəbi hamısı məqsəd toyla icazə veril nə gözlə qəşənqız qəşənqoğla mən
250,azərbaycan qadın xoşbəxt olma layiq istək jan klod va dam gəlin olsun istək əl kişi birinci çətin ikinci çətin mən
251,birik itirmə istə on ürəkdən sev sevmə sev inan özbaşına rədd ol gedəcək mən
252,iş görək sifon çəkin yazı tualet yığışdırıl gün ölkə düzək mən
253,beynəlxalq uşaq günü münasibətilə sək təbrik edi qəşəng olma hələ papa mama yaşa mən
254,o ev maşın iş nə covid pasport şirin çay gəl mən
255,gün olsun bəxt açıl qəşənqız
