,Text
826,gənc ailə ev dəyişmə istə sərfəli ipoteka kredit yel bank vaxt itirmə illik dən başla əlverişli şərt kredit sifariş et yelbank ipoteka b
827,şəhid adı əsgəri şücaət daim qəlbi yaşa günü biz yaşa qarşı hörmətlə baş əyir yak azərbaycan əsgəri zəfər günü mübarək
828,parlaq zəfər əmanəti aç qara dirçəliş dəstək ol qarşıdan gələn zəfər bayram münasibətilə qara dirçəliş fond əməkdaşlıq əsasında yeni parlaq zəfər əmanəti təqdim edi qara azərbaycan ətraflı yel
829,noyabr yel app üzərində azı manat ölkə pul köçürmə vasitəsilə et lotereya qazan təsadüfi seçim nəticə qalib olan nəfər biri ol ətraflı yelbank yelkart ani
830,kampaniya kəs üç min manat nağd pul kredit illik cəmi lə ək etmə mümkün kredit maksimal müddət ay sifariş yel yel kredit
831,yeni baş ofis rəsmi açılış tədbir olan video siz bölüşmə istə parlaq bank davam yel headoffice bra parlaq
832,böyük komanda növbəti parlaq uğur ilin əvvəli bank xalis mənfəət milyon manat çaq bank aktiv milyon manat art milyon manat təşkil edi inan ilin son göstərici artma davam ed
833,baş ofis açılış çıxıq zaman vahid ələk ilin əvvəli həyat keçiril yeni strategiya düzgün əmin bildir bank yüksək maliyyə göstərici buq sübut ol ifadə edi yel
834,bank yeni baş ofis rəsmi açılış mərasim baş tut tədbir bank əsas səhmdar vahid ələk azərbaycan respublika mərkəzi bank sədri elm rüstəmov rəsmi şəxs iştirak et yeni binam parlaq bank konsepsiya uyğun təmir edil
835,oktyabr hemofiliya tale xəstəliyi əziyyət çək körpə dəstək əməkdaş baş ofis dəvət olun mərkəzi qan bank peşəkar həkim heyət nəzarət altın qan ver yel yel qan
836,il gün ölkə uzun il bəri həsrət ol müstəqil il göstər il şücayət bütövlük qovuq azadlıq mübarək azərbaycan
837,filial şəbəkə uğur artırma davam edi parlaq bank öz əks etdir filial sırası yeni xalq dostluq filial qatıq bəhr nur kü ünvan yerləş filial müasir interyer rahatlıq fərqlən
838,gün davam e müharibə qəlbi şəhid adla yazıq qələbə adı yazıq zəfər adı yazıq qara biz qaytar qəhrəman ehtiramla yad edi vətən sağ olsun qara şəhid vətən anım
839,peşə bayram münasibətilə neftçi özəl kredit kampaniya komissiya illik dən başla sərfəli şərt nağd pul kredit yel bank siz gözlə müddət məbləğ az vaxt itirmə sifariş etmə tələs
840,cəbr rayon coc mərcanlı kəndi baş tut kənd idman inkişaf etdir layihə dəstək ol yel kəndidmaninkişafetdir cocmərcanlı
841,planla nə artan filial şəbəkə inkişaf hansı rok oynaq biznes dəstək hansı imkan yaradıl mövzu idarə heyət sədri müavin el pir ətraflı söhbət et müsahibə bur oxu
842,biznes kredit alma banka getmə gözləmə sənədləşmə ehtiyac yoq yel bank aya güzəşt müddətli mikro kredit kart köçürülmə imkan yaraq xidmət istifadə rahat sifariş yelbank mikro
843,sentyabr tarixi qara dirçəliş fond azərbaycan bank assosiasiya rəyasət heyət üzv görüş keçiril yel bank qara dirçəliş fondnun ianə sertifikat təltif olun qaradirçəlişfond qaraüçünianəet qaraıdahatezbərpaedək
844,payız yel bank illk l kredit qarşıla az nağd kredit sifariş et
845,parlaq yel appimiz daxil pasport tələb olun tətbiq istifadə on yüklə qeydiyyat keçmə kifayət bank əməliyyat yel app et sağlam vaxt qoru yüklə
846,light yoxsa premi seçim asılı olmaya kart aşağı üstünlük sən olacaq də cashbac balans qalıq gəlir komissiya nağd sap mobil əlavə kart pulsuz alma imkan yel
847,cür fürsət ələ düşmə kəsə illik lə az kredit kl yaxınlığında sifariş et sərfəli şərt yararlan yel yel kredit
848,məqsəd fərqli ol bil təki onlar reallaşdırma uyğun kredit olsun kəsə lə az kredit vaxt itirmə sifariş et
849,yeni yel kart al kod on təyin etmə istə zaman set web xidməti faydalan bilək istifadə qayda sadə hələ yel kart yox sifariş yelbank yelkart
850,türki zaman yanında qardaş ölkə meşə yenidən yaşılla deyə azərbaycan bank assosiasiya təşəbbüs qoşul əməkdaş adıq fidan göndər
851,olimpiya qələbə harada mükafat avqust yel vis kart wolt sifariş ödə cashbac başqa hədiyyə qazan ətraflı
852,ad günü avqust az kredit ərzində komissiya endirim bilək arzula çin olma sifariş et yel bir komissiya
853,ilin ikinci rüb üzrə hesabat dövr ml manat artıq xalis mənfəət bak vur ötən ilin son müqayisə əksər maliyyə göstərici müsbət dinamika müşahidə olun ilin sonnadək böyük nəticə ək edəcəyimiz inan
854,həs bəy zərdab əsas qoy iş davam etdir işnə vurğun olan media işçi bayram münasibətilə təbrik edi söz zaman qüvvətli səs daima ucadan gəl milli mətbuat jurnalistika günü mübarək
855,biznes kredit lazım cəmi banka yaxınlaş kredit rəsmiləşdirmə kifayət növbəti kredit kart köçürül gözlə sifariş et
856,bolt sürətli endirim sentyabr bolt vis holida kateqoriya taksi sifariş et yel vis kart ödə endirim yararlan yelbank yelkart vis bolt
857,il qeyd et azərbaycan silahlı qüvvə günü il qürurla qeyd edi qürur mənbə əsgər şücaət yenilməz ruh günü şəhid biz qələbə yaşa igid həsr edi bayram mübarək
858,yeni sədər filial təqdim edi yeni konsept təmir edilə i veril filial sayca üçüncü fili müştəri rahat düşük xırda detal nəzər alma çalış
859,gənc dəstək layihə davam ol avrop gənc parlament əməkdaşlıq görük keçir gəncimizin parlaq nümayəndə araq topla cəmiyyət akt olan mövzu müzakirə et təşkilat əməkdaşlıq çərçivə böyük işlə görük
860,parlaq sap tətbiq rahat funksiya xərclə idarə et on növbə götür kredit kart sifariş bu artıq yel app əlavə yükləmə
861,uşaq beynəlxalq müdafiə günü münasibətilə başla kiçik biznesmen layihə nəticə siz bölüşmə istə qeyd e layihə məqsəd uşaq kiçik yaşla pul düzgün rəftar etmə öyrən gələcək uğurlu olma
862,kampaniya az nağd kredit cəmi lə üstəlik komissiya sığorta xərc əməkhaqqı misl zamin yoq sifariş
863,pul art parlaq yoluq göstər lə sabit əmanət aç pul pul gətir ətraflı yel sabit b
864,il cum yaranma günü vətən ərazi bütövlük bərpa olun şəkil qeyd etmə günü özəl edi qələbə biz yaşat şəhid əsgəri qarşı baş əyir respublika günü mübarək
865,il cum yaranma günü vətən ərazi bütövlük bərpa olun şəkil qeyd etmə günü özəl edi qələbə biz yaşat şəhid əsgəri qarşı baş əyir respublika günü mübarək
866,ayı saat peşəkar məzun mikro istiqamət üzrə işə görük keçir yel dan karyera imkan ha məlumat veril namizəd uyğunluq nəzər keçiril yel yel
867,əmanəti arzula gəlir gətirmə faiz dərəcələ də yüksəlt hələ deyil ətraflı məlumat bur daxil ol
868,parlaq bank ünvan bilik bilin daxil olun istə məhsul barə məlumat ək edi kredit kart sifariş edi on növbə götür yel b yel
869,ramazan bayram bir dəyər vermə öy yaxın sevmə xatırla qoy bayram xalqı sağlamlıq xoşbəxtlik bolluq gətir ramazan bayramnız mübarək
870,ikinci dünya müharibə azərbaycan xalqı fədakar qəhrəman cəsarətli ol göstər ötən il qal gəl vətən müharibə buq sübut et faşizm üzərində qələbə günü mübarək
871,axır həftəsonu gəl demə tələsmə yad salıq sabah gün ol iş günü
872,yel bank yüksək faiz xilas edi kredit biz gətir aylıq ödəniş azalt sifariş yelbank kredit b
873,yel mobil əlavə ödəniş etmə rahat buq şablon avtomatik ödəniş funksiya xidməti əlavə yükləmə yelbank yelapp
874,növbəti yel xoş gəl tədbir hazırlaş azərbaycan dövlət neft sənaye universitet məzun tələbə keçir görük bank fəaliyyət haqqında danış bank karyera inkişaf bağlı məsləhət vermə planlaşdır
875,yel xoş gəl tanışlıq görüş keçir i format keçiril tədbir dən artıq azərbaycan müxtəlif universitet kollec təhsil alan gənc qoşul yel yel welcometoyelo
876,gənc düşün yel wal and talk mentorl layihə elan edi çərçivə yelnun idarə heyət üzv mentor qismin gənc öz peşəkar yetişdirmə bank karyera qum məsləhət verəcək tələbə sək yemə iştirak edəcək
877,yel bank yüksək faiz xilas edi kredit biz gətir aylıq ödəniş azalt sifariş
878,son zaman artan dələduzluq hal əlaqədar kart məlumat kənar şəxs paylaşma xahiş edi şübhəli hal rastlaş dərhal nömrə əlaqə saxla
879,böyük məmnuniyyətlə siz xəbər paylaşma istə aprel saat bank azərbaycan tələbə gənc təşkilat ittifaq birgə yel xoş gəl tanıq on sessiya keçir biz izləmə davam edi yel yel welcometoyelo
880,yel bank ilin rüb ml manat xalis mənfəət bak vur hesabat dövr bank əsas maliyyə göstərici üzrə pozitiv dinamika qeyd olun ətraflı
881,ol yek yel bank yanında bank əməliyyat etmə smartfonunuz yalnız yel app olma kifayət
882,beynəlxalq qadın günü münasibətilə mart tarixi istehlak kredit yalnız xanım özəl endirim təqdim edi fürsət yararlan tələs kredit on sifariş edi yel yel mart
883,novruz özəl min az biznes kredit sərfəli şərt təklif edi komissiya ayı faiz hədiyyə aya güzəşt müddət şərti girov ev baxış tələb olun sifariş edi yel kredit
884,novruz biz hazır olun mart ayıq son əməkhaqqı asılı olmaya hamı illik lə min manat nağd pul kredit təklif edi kredit on sifariş etmə yel kredit yel novruz
885,pul işlə deyə martı əmanət məhsul faiz dərəcə artır yel sabit illik əlavə etmə imkan olan yel yığım illik gəlir qazaq bilək ətraflı məlumat
886,şagird gələcək həyat hazırlıqlı olma keçirt yel school on təlim iştirakçı sertifikat təltif edi təlim lən rayon bol kəndi nömrəli orta məktəbi sinif şagird iştirak edi yelteam
887,cəmi dəqiqə kredit dən başla nağd pul kredit on sifariş et yel kredit yel
888,vergi işçi peşə bayram münasibətilə az nağd kredit zamin komissiya dən başla şərt təklif edi sərfəli şərt fevral də yararlan bilək sifariş yel vergi kredit
889,capital fin internat beynəlxalq nəşr iş yüksək qiymətləndir biz i korporativ re strategiya azərbaycan nominasiya qalib elan et il re çərçivə baş ver dəyişiklik yenilik bağlı video
890,hansı gündə ol asılı olmaya doğul ərzində az kredit komissiya endirim bilək arzula çin olsun deyə sifariş edi yel bir komissiya
891,yeni hədəf başla ilin bəhrə artıq görmə başla yanvar ayıq milyon mənfəət bak vur bu yanaşı əvvəlki dövr müqayisə bank əməliyyat xərclə nəzər çarpa azalma müşahidə olun yel yeni
892,siz vis concierge çat tanış etmə istə çat yel vis platin kart üstünlük barə məlumat alma imkan ver neçə addım həmişə əl altın olan köməkçi ək edəcək visconsierge
893,gömrük işçi peşə bayram münasibətilə nağd kredit komissiya dən başla şərt təklif edi fevral vaxt link daxil ol sərfəli kredit sifariş edəsiz yel komissiya kredit
894,azərbaycan hüquqi şəxs sahibkar rejim ani ödəniş sistem üzərində hesabla köçürmə ödənişi etmə imkan yarat yel aniödənişsistem biznes
895,aya güzəşt müddətli dən başla maksimal məbləğ min az olan mikro kredit azərbaycan yel bank mikro kredit birbaşa biznes kart köçürül on sifariş
896,vaxt qənaət etmə istə xatırlatma link daxil ol filial gözləmə növbə on bilək
897,istə vaxt istə yek az kredit on sifariş et filial yalnız hazır olan yaxınlaş cəmi neçə dəqiqə kredit götür sifariş
898,yel bank müştəri ölkə mikro biznes sahib kredit kart köçürülmə imkan yaraq xidmət istifadə etmə cəmi banka yaxınlaş kart alma kredit rəsmiləşdirmə kifayət sifariş
899,maliyyə qlobal iqtisadiyyat bank üzərində ixtisaslaş nüfuzlu beynəlxalq nəşr olan capital fin internat iş yüksək qiymətləndir biz i korporativ re strategiya azərbaycan nominasiya qalib elan et
900,cənab prezident doğum günü mübarək biz qürurlu qələbə yaşat minnətdar
901,dəyər zəmanətli vauçer su volkswage passat qazanma aprel il tarixi araq sp fa su yel vis kart ərzində azı az alış etmə kifayət
902,biz kredit fərqli aşağı yuxarı kəsə kredit düz lə ver fürsət qaçırma on sifariş et yel yel
903,azərbaycan ayrılmaz parça gözəl təbiətli istisu bulaq güllü kəl azadlıq mübarək xalqı tarixi gün münasibətilə təbrik edi şəhid qarşı baş əyir qara kar
904,yel bank komissiya maaş misl kredit alma ol barə ətraflı xəbər hazırla su sifariş
905,vətən uğrunda döyüş xəsarət al müştəri ziyarət et on yaralı hal xəstəxana olma baxmayaraq qələbə sevinc tanı iştirakçı dilik eşitmə ək et qələbə dəyərli ol sübut et
906,xəyal qurd günü gün yaşa biz azad ağdam gözlə biz imarət stadion cümə məscid gözlə biz qara çiçəklən gələcək gözlə şəhid ruh şad olsun azərbaycan əsgəri olsun qara
907,ilin günü azərbaycan dirçəliş yolunda dönüş nöqtə ol il əminlik xalqı yenidən adlandır bilək torpaq millət olğumuz qürurlu yak azərbaycan
908,yeni yel yığım əmanəti istənil vaxt vəsait əlavə etmə mümkün yel bank sabahı gündə planla ətraflı
909,xərclə təxir salma əməkhaqqı misl komissiya istehlak kredit yel bank sək gözlə sifariş yelbank komissiya kredit
910,düşmən bərdək raket atəşin tutma nəticə ağır yaralan həmkar paşa niftalın həyat xilas etmə mümkün olma yel ailə ol həmkarın ailənə səbr dilək dəstə əsirgəmə bildir allah rəhmət eləsi prayforbar
911,yel bank kart minimum az nağdsız ödəniş edər lotereya qoşul qazanma şans ək et ətraflı
912,qu dağla yamyaşıl yaylaqla b dalğalan b çaq laləzar körpü biz gözlə qoy şanlı ordu parlaq qələbə daim baş ucalt qara azərbaycan qaraazərbaycan kar qu
913,biz olsun xalqı igid əsgər şanlı ordu yalnız qara kar
914,il xud körpü yenidən üçrəngli b dalğalan əsgər yeni şərəfli tarix yak ordu afərin kar qara
915,döyüşən əzmkar ordu növbəti dəstək aksiya təşkil et ilkin yardım tibbi ləvazimat isti geyim ön cəbhə vuruşan əsgər hərbi hospital göndəril çətin dönək həmrəylik nümayiş etdirmə ordu dəstək olmalı
916,salam əsgər gün ordu qəhrəmanlıqla haqqında xoş xəbər alıq qürur hədd yoq öz qoru biz fikir eləmə minlərlə igid oğul sayəsində biz qayda siz sevgi yel
917,vətən ərazi bütövlük uğrunda mübarizə apar igid oğul ü siz döyük yak azərbaycan əsgəri
918,mövcud şərait bağlı banka olan sorğu çağ mərkəzi rəsmi sayt elektron poçt ünvan vasitəsilə etmə tövsiyy olun vpn vasitəsilə sosial şəbəkə üzərində müraciət şəxsi məlumat məxfilik baxım təhlükəli
919,yel bank növbəti yenilik korporativ müştəri internet bank xidməti istifadə ver yeni xidməti özünəməxsus dizayn rahatlıq geniş funksionallıq seçil yelbank internet b
920,yel bank aşağı faiz vaxt başla min manat istehlak kredit dən başla faiz götürə bilək buq on sifariş etmə kifayət
921,artıq yel bank nikoyl bank kart manat məbləğ olan ödəniş kod daxil etmə təmas şəkil ödək bilək yelbank təmas yelkart
922,yel layihə çərçivə lən rayon bol kəndi saylı orta məktəbi təhsil nəticə fərqlən aztəminatlı ailə olan şagird müəllim planşet internet paket hədiyyə edil
923,min manat istehlak kredit dən başla faiz götürə bilək detal bilmə xəzər xəbər hazırla süjet baxma kifayət sifariş
924,z gül qibtə edi
925,z dünən ev buq söhbət gedik
926,yüz il öncə şuşn düşmən işğal qoru xosrov bəy böyük mütəfəkkir əh bəy məzar şuş torpaq baş redaktor yazı link tarix his dilqəməh şuş əhbəyağaoğlu xosrovbəysultanza
927,əsr öncə düşmən qovaq şuşa üçrəngli b dalğalandır babal varis həmin düşmən birdəfəlik qovaq həmin bayraq uc qaldır günü mübarək bayraqmız kərə yüksələn bayraq enmə azərbaycan bayraq
928,əziz şuş azad əziz şuş qayıt əziz şuş sək dirçəl zəfər mübarək azərbaycan qara şuş shush zəfər
929,çapar yayınla həftəsonu yarmarka gəlin nəşr sək saat axşam siz görmə məmnun qalac hüsey cavid park nəşr ək e bilək tarix his kitab jurnal azərbaycan cümhuriyyət
930,üstəlik çatdırılma ödənişsiz b zəfər çal günlə b tarixi birlikdə oxu tarix his kampaniya hədiyyə endirim kitab jurnal b yeni
931,dəyərli dost yeni kampaniya start ver noyabr tarix zəfər günü bayraq günü münasibətilə azı l kitab alan kəsə baş redaktor dilqəm əh mühacir miras kitab hədiyyə olacaq
932,cümhuriyyət günü mübarək türki azərbaycan
933,dərəcəli müşavir dərgi dəyərli dostu ram müəllim yaşın tamam olma münasibətilə təbrik edi ram müəllimə vətən millət tarixi göstər xidmət dərin təşəkkür bildir tarix his ramabutalibov çapar jurnal
934,əziz su dəyərli dost üç gündə su gəlir bəs kitab bayram gələcək dostınızı etiketlə kəs xəbərdar olsun gənc böyük tədbir gənc şəhər su kitablagəlir tarix his kitab jurnal b
935,rəşadətli azərbaycan ordu əks hücum əməliyyat nəticə qu rayon düşmən işğal azad olunma il öt yak azərbaycan ordu yak azərbaycan quazərbaycandır qara
936,rəşadətli azərbaycan ordu əks hücum əməliyyat nəticə zəng rayon düşmən işğal azad olunma il öt yak azərbaycan ordu yak azərbaycan zəngazərbaycandır qara
937,z üzül
938,qeyd e tərəf növbəti sərgi noyabr ayıq gənc şəhər keçirilmə planlaşdırıl su kitab
939,eyni zaman sərgi müddət məşhur şair yazıçı iştirak təqdimat imza günlə şeir gecələ keçirilmə planlaşdırıl sərgi saat dan də davam ed kitabsevər dəvətli
940,çapar dərgi azərbaycan nəşriyyat ictimai bir istinadən xəbər ver sərgi ölkə dən artıq tanınmış nəşriyyat iştirak ed sərgi nəşriyyat tərəf kitab də endirim tətbiq olun
941,oktyabr tarix azərbaycan nəşriyyat ictimai bir təşkilatçılıq su dövlət dram teatr su kitab sərgi təşkil olun
942,gün azərbaycan müstəqil bərpa illik yanaşı tarixi xud körpü düşmən işğal azad olunma illikni qeyd edi qara
943,dekabr azərbaycan xalqı ümumxalq səsvermə akt təsdiq edər müqəddərat müəyyən etmə iradə ortaq qoy tarix his azərbaycan respublika cümhuriyyət oktyabr dövlət millət xalq müstəqillik istiqlal istiqlaliyyət
944,oktyabr il azərbaycan ali sovet azərbaycan dövlət müstəqillik haqqında konstitusiya akt qəbul edi konstitusiya aktna azərbaycan respublika azərbaycan cümhuriyyət hüquqi varis elan olun
945,rəşadətli azərbaycan ordu əks hücum əməliyyat nəticə füzul rayon düşmən işğal azad olunma il öt yak azərbaycan ordu yak azərbaycan füzulazərbaycandır qara
946,dost taq edi kəs xəbərdar olsun tarix his kitab jurnal endirim kampaniya azərbaycan cümhuriyyət respublika müstəqillik istiqlal
947,çapar dərgi son altı sak deyil çapar rəsul dəsti deyil rəsul rəsmli qeyd dəftər rəsul imzalı qələm deyil
948,vquliyev cümhuriyyət yazıl deyil ədalət tahir ərməğan deyil azərbaycan təşəkkül deyil məkb cümhuriyyət hekayə deyil
949,əta də azərbaycan cümhuriyyət son on nüsxə deyil mrəsulza azərbaycan müstəqillik mübarizə yolunda nəşr deyil bəzi cümhuriyyət ge yol deyil
950,ən azərbaycan səlcuq yaqut deyil az qələmi uçuq deyil əta azərbaycan cümhuriyyət milli dövləti gerçək adı deyil
951,əh bəy ağa şuş peterburq park xatirə ata iki məktub deyil məhəmmədəm rəsul azərbaycan mübarizə yolunda nəşr son on nüsxə deyil dəh mühacir miras deyil
952,yalnız gün oktyabr tarix l jurnal kitab ək edən aşağı endirim yararlan bil də milliyyət türk iki nüsxə deyil er bayram deyil
953,dəyərli izləyici müstəqil bərpa illik münasibətilə nəşr də endirim kampaniya başla şəhərdaxili çatdırılma ödənişsiz
954,azərbaycan ictimai xadim molla nəsr jurnal təsis öm fa nemanzadən vəfat il öt tarix his mollanəsr ömfanemanzadə ömfa
955,dəyərli elm adam dövlət xadim professor vilayət qul cümhuriyyət yazıl kitab təqdimat professor ədalət tahir mədəniyyət nazik ana kərim təqdimat mərasim iştirak edi tarix azərbaycan cümhuriyyət vilayət ədaləttahir bak
956,mamedasgerov afitapr xeyr tələb olma dəqiqləşdirmə lazım dövlət sığorta agent dəqiq öyrənmə ol
957,mamedasgerov afitapr operativ qərargah qərar ver oktyabr birik yek iki vaksin tələb olun
958,afitapr mamedasgerov təəssüf qərar asılı deyil
959,dəyərli izləyici siz yoluq yeni nəşr gözlə bak ekspo mərkəzi oktyabr il tarix çapar stend tarix his kitab b yeni roman topçu müşfiq cümhuriyyət
960,dəyərli izləyici dəyərli dost oktyabr il saat dərgi müəllif profvilayət qul cümhuriyyət yazıl kitab təqdimat olacaq biri yoluq gözlə ünvan bak ekspo mərkəzi bak beynəlxalq kitab sərgi tarix
961,dəyərli dostu rəsul həs qapaqla hazırla yeni kitab isti tanış ol bak beynəlxalq kitab sərgi gəlin çapar stend yaxınlaş kitab endirimli qiymət ək edi tarix his kitab sərgi bak rəsulhəs
962,bak əl oyun saray milli kitab satış sərgi çapar stend yaxınlaş nəşr endirimli qiymət ək edi tarix his kitab yeni azərbaycan cümhuriyyət topçu azərbaycan müşfiq cümhuriyyət roman
963,dəyərli dost dəyərli izləyici yeni nəşr şəhər iki yerində sabah siz yoluq gözlə əl bəy topçu azərbaycan təşəkkül müşfiq ək cümhuriyyət hekayə ünvan bak ekspo mərkəzi bak beynəlxalq kitab sərgi
964,milli kitab satış sərgi oyun saray vi bak beynəlxalq kitab sərgisibak ekspo mərkəzi peşə bayram münasibətilə müəllim təbrik edi tarix his müəllim endirim kampaniya
965,oktyabr müəllim günü münasibətilə oktyabr tarix müəllimə çapar yayınla nəşr endirim olacaq endirim iki kitab sərgi keçə
966,ədalət tahir milli kitab satış sərgi stend ədalət müəllim kitab imzalı ək etmə istə bak əl oyun saray buyur tarix his ədaləttahir
967,milli kitab satış sərgi stend artıq hazır sabah etibarən on gün saat aralı yolun gözlə nəşr endirimli qiymət ək e bil qeyd oktyabr ədalət tahir sərgi qonaq olacaq tarix his kitab
968,dəyərli izləyici oxucu dost milli kitab satış sərgi siz gözlə oktyabr il tarix əl oyun saray stend yaxınlaş nəşr endirimli qiymət ək e bilək tarix his çapar çapar
969,xalqı otuz yaxın müddət yaşa məğlubiyyət acı çıxar qalib olma xatırla şəhid qürur hüzn dərin hörmət rəhmət minnət duyğu yad edi bizlə siz zaman borclu olacaq şəhid tarix azərbaycan qara
970,çapar yayınla yeni nəşr siz gözlə stend yaxınlaş nəşr ək edi müəllif görük sərgi günlə hansı müəllif imza günlə olma istə tarix his kitab b bakubfair bhause blover
971,bak beynəlxalq kitab sərgi sayılı günlə qal oktyabr il tarix bak expo mərkəzi tam beş gün ərzində mədəniyyət nazir təşkil et sərgi ölkə əksər nəşriyyat iştirak ed
972,azərbaycan cümhuriyyət parlament ac park sülh konfrans nümayəndə heyət üzv mir mir o meh doğulma il ötür tarix his azərbaycan cümhuriyyət parlament parksülhkonfransı mirmehdiyev
973,azərbaycan cümhuriyyət sovet azərbaycan himn yazan üz bəy sirk baş redaktor yazı aşağı link oxu bilək tarix his azərbaycan sirr musiqi üzbəyhacıbəyli
974,sentyabr il böyük bəstəkar müsl maqomayev doğum günü tarix his musiqi müslmaqomayev bəstəkar
975,sentyabr milli musiqi günü üz bəy şuş şuşdan şuşlı salamla dərin hörmətlə an xalqı yolunda çək əziyyət qarşı baş əyir tarix his musiqi incəsənət ədəbiyyat mətbuat siyasət qəzet naşir müəllim üzbəyhacıbəyli
976,mühacirət mətbuat öyrənilmə əhəmiyyətli tarix his nur bak nur nəsim bak
977,eyni zaman tanınmış azərbaycan şair qaf islam ordu qəhrəman türk əsgər həsr et şeir kitab daxil edil kitab müəllim aspirant tələbə faydalı olma yanaşı azərbaycan əlaqə sistem
978,müəllif kitab tarixi sənəd yazıl fakt topla oxucu çatdırma çalış öncə azərbaycan xalq cümhuriyyət il dövr nəşr edil yazıl son ada mühacirət yaşa azərbaycanlı siyasətçi ziyalı məqalə toplan
979,dərgi müəllif dəyərli alim nəsim ya bak qurtuluş qaf islam ordu kitab nəşr olun kitab əsr azərbaycan milli istiqlal mübarizə tarixi mühüm olan bak qurtuluş araşdırıl
980,sentyabr il bak işğal azad olunma rəhbərlik e nur paşa tarix his azərbaycan cümhuriyyət bak bakazadolunması türki osmanlı qaf nurpaşakilligil nur
981,sentyabr il bak işğal azad olunma ildönümü münasibətilə baş redaktor bak adıq soyad götürə komandan adlı yazı aşağı link oxu bilək tarix his azərbaycan cümhuriyyət türki osmanlı
982,güney azərbaycan qurul demokratik respublika azadıstan dövlət başçı xiyaban öldürülmə il öt tarix his azərbaycan azadıstan xiyaban
983,dəyərli dostu dərgi müəllif drorxa vəli azərbaycan millətçi dövləti yaranma kitab təqdimat ol qeyd e kitab öncə türki nəşr olun tarix his azərbaycan millət o
984,görkəmli ədəbiyyatşünas alim sak mümtaz il repressiya zaman on il müddət həbs olun lakin dörd il sentyabr il o həbsxana güllələn tarix his ədəbiyyat liter sakmümtaz repressiya
985,müzəffər azərbaycan ordu şücaət sayəsində qu rayon işğal il öt tarix his qu azərbaycan işğal ordu azadlıq
986,tanınma ümid bəslə azərbaycan respublika dövlət müstəqil bərpa olun elan edi bəyannamə il avqust azərbaycan respublika ali sovet növbədənkənar sessiya qəbul edil
