,Text
2146,bak dini bayraq toy karvan təşkil e sürücü maşınla cərimə meydança aparıl covid pasport olmaya manat cərimələn toy təşkilatçı saxlanıl toy olan birik axtarış ol məlum ol barə cinayət iş açıq
2147,türki rusi vətəndaş saxlanıl ant ərazi meşə sahə yandırma şübhəli bilik saxlanıl meşə ol lakin yanğın törətmə əksinə yanğın görən barə xəbər ver de
2148,ilham əl mehriban əla qu rayon səfər edi səfər zaman qu yarımstansiya açılış iştirak edi dsxn yeni hərbi hissə kompleks açılış ol xanlıqqu yoluq təməl qoy ictimaiyyət nümayəndə görüş
2149,rayon getmə istə pasport yox bak beynəlxalq avtovağzal bilet satıl bilet alma vağzal yaradılan məntəqə vaksin olunma lazım azərbaycan yerüstü nəqliyyat agent mətbuat xidməti rəhbər nur allah
2150,gün baş nazir nikol pa parlament növbəti ilin dövlət büdcə bağlı dinləmə iştirak edi de il müdafiə sahə milyon dollar vəsait ayrıq
2151,səhiyyə nazirlik risk qrup olan hamilə qadın vaksinlənmə çağır risk qrup yak yuxarı piylənmə diabet hipertenziy böyrək qaraciyər aut sistem xəstə hamiləlik həftə pfizer peyvənd olunma tövsiyə edil
2152,ilham əl gələn türki gedəcək türki azərbaycan səfir cahid bağçı de iəl ərdo oktyabr qara noyabr i görük noyabr i türk şura dövlət başçı zirvə görük olacaq
2153,oktyabr ölkə ərazi keçiril toy şən monitorinq aparıl toy şənlik keçirilmə xüsusi karantin rejim qayda poz nəfər cərimə olun nəfər pasport olma şənlik buraxılma
2154,işğal azad edilə çaylı kəndi ər stasionar post kənar yolla daxil olan nəfər saxlanıl avtomobil yük yerik dəmir boru aşkarla saxlanıl gün müddət inzibati qayda həbs edil
2155,feminist fəal səna yağmur cinsi zorakılıq törətmə ittiham olun əsgər ağaz barə aylıq həbs tədbir seçil məlumat səna yağmur vəkil zib z yak
2156,ilham əl de vejnəl qızıl yata erməni birgə istismar e xarici şirkət məhkəmə veril de proses start veril işə beynəlxalq hüquqşünas cəlb edil
2157,azərbaycan tərək qara qanunsuz keç həbs et iki irq vətəndaş azadlıq burax dünən irq rəsmi şəkil sürücü azərbaycan sərhəd pozma qara getmə qadağan edi
2158,tey foton keçmiş erməni prezident komsomol bilet göstər iddia yanlıq foto ser sar montaj
2159,azərbaycan hökumət iddia edi multikultural ölkə rəsmi şəxs de ölkə yaşa xalq hüquq pozul yazı göstər multikultural ölkə olmalı
2160,parlament təmsil olun partiya sabah yak toplan hal görüş keçiril müzakirə edilə hansı məlumat yoq
2161,azərbaycan gender bərabərlik bağlı qanun boşluq müşahidə edil milli məclis ailə qadın uşaq məsələ komitə sədri hicran hüseynov de gender bərabərlik bağlı qanun dəyişiklik layihə hazırlan rəhbərlik təqdim edil
2162,diqqət feminist fəal səna yağmur qarşı cinsi zorakılıq törə əsgər ağaz saxlanıl barə sənaın ana zümrüd yağmur məlumat ver on gün prokurorluq çağır məlumatlandır
2163,azərbaycan erməni ara gərginlik yenə yüksək səbəb nə
2164,erməni baş nazik nikol pa gün bəyan edi azərbaycan ordu erməniın şərq sərhəd içəri daxil ol
2165,iraq baş ver zəlzələ azı nəfər xəsarət alı nəfər ölü
2166,bazar günü glasgow beynəlxalq iqlim sammit yekun sənəd imzalan cop sammit önəmli ətraflı
2167,azərbaycan doza peyvəndlənmə haqqında bilmə sual cavab
2168,erməni tərək iki ölkə dövlət sərhəd danışıq yoq de demarkasiya maraqlı deyil azərbaycan bazar günü noyabr yay məlumat qeyd edi ətraflı
2169,qara sülhməramlı gələcək olacaq ətraflı
2170,bazar günü iraq cənub hör əyalət bal güc zəlzələ ardınca güc afterşo olan ikinci yeraltı təkan baş ver irq rəsmi nəfər həlak ol nəfər yaralan bildir
2171,son məlumat azərbaycan kor infeksiya yeni yoluxma fakt qeyd alıq gün qabaq rəqəm ol
2172,azərbaycan erməni ordu sərhəd laçın sahə vəziyyət gərginləşdirmə cəhd et bildir ətraflı
2173,erməni azərbaycan ordu irəliləmə cəhd qarşı al bildir ətraflı
2174,azərbaycan mövqe muxtar erməni tərək intensiv atəş tutul bildir ətraflı
2175,sammit iqlim pakt qəbul edil ekspert on səthi kəsərsiz adlandır
2176,günlük ikinci qara müharibə yekunlaşdır il noyabr tarixli üçtərəfli bəyanat hansı bəndlə yerinə yetirilmə öhdəlik vaxt limit vaq sual cavab ətraflı
2177,azərbaycan min yaxın şəkərli diabet tutuq insan noyabr ümumdünya diabet günü qeyd edil arxiv
2178,rusi üçtərəfli bəyanat ildönümü bağlı yay bəyanat sək ümumilik yerinə yetiril bildir azərbaycan hesab edi maddə hələ yerinə yetirilmə hansı
2179,ürək sağlamlıq yuxu yeganə amil olma düzgün vaxt yatma infarkt risk azal araşdırma
2180,yenilik türki ordu çoxdan vaq ordu yalnız dağ hərbi hissə vaq artıq biz hərbi hissə sak artırıl azərbaycan ordu yeni qurumla yaradıl
2181,azərbaycan kor yeni yoluxma qeyd alıq nəfər ölü tam məlumat keçid
2182,avropan hüquq orqan müasir b tarixi qala hay qarət rəhbərlik et güman olun şəxsi axtar kim keçid oxu
2183,türki miqrasiya müqavilə yenilə mühacir axın qarşı alma çalış lakin il davam e köç dalğa bel sərhəd istiqamət alı keçid oxu
2184,azərbaycan şuş yaxınlığındakı post hərbçi qumbara atıl
2185,noyabr bəyanat hansı bəndlə yerinə yetirilmə öhdəlik vaxt limit vaq sual cavab
2186,azərbaycan vurulan vaksinlə ümumi sak milyon keçi azərbaycan vurulan vaksinlə barə link oxu
2187,hazırda polşabelaru sərhəd azı mühacir polşabelaru sərhədki miqrasiya böhran barə ətraflı sayt oxu
2188,üçtərəfli işçi qrup çərçivə bak yer azərbaycan tərəf erməni keçmə nax ge yolun verilmə imkan müzakirə edi barə erməni təhlükəsizlik şura katib bildir azərbaycan məlumat şərh etmə
2189,noyabr bəyanat barə başqa sual cavab link oxu
2190,azərbaycan erməni barışma rus getmə zərd əl
2191,azərbaycan noyabr bəyanat bağlı erməni ittiham cavab ver ətraflı link oxu
2192,erməni yerli avtomobil gor yoq hərəkət qadağan edi
2193,gürcü keçmiş prezident saakaşvil aclıq aksiya dayandırma şərti açıqla gün aclıq aksiya edi ətraflı sayt oxu
2194,gün aclıq aksiya e keçmiş gürcü lider saakaşvil de iradə əleyhinə həbsxana xəstəxana köçürül
2195,son il azı adıq dəyiş b tarixi böyük qarət birik ittiham olun şəxs kim
2196,moskv avrop ittifaq ara mi böhran enerji təchizat bağlı artan gərginlik fon rusi ukraynay müdaxilə nəzər keçir bil bağlı narahat avroplı müttəfiq bölük
2197,polşabelaru sərhəd miqrasiya böhran sual
2198,at min qrup azərbaycan erməni qızışdırıcı ritorika təxribat xarakterli hərəkət çəkinmə çağır
2199,işıq söndür arxa söykək dəqiqə sakitcə otur yolla yeni öyrən fakt yaxşı yak saxla fərq var arxiv
2200,orqanizm bioloji saat uyğun vaxt yatma infarkt insult risk azal alim nəticə gəl link oxu
2201,b tarixi böyük qarət birik ittiham olun şəxs kim
2202,son üç il xarici ölkə alın diplom azərbaycan tanınma min nəfər müraciət edi nəfər imtina cavab veril veril imtina səbəb hansı məqalə oxu
2203,dünya görmə erməni azərbaycan xəta təhlükəsiz yaşa rus getmə politoloq zərd əl qara rus sülhməramlı barə de ətraflı link oxu
2204,erməni baş nazik nikol pa hökumət iclas de gor sahə azərbaycan post qurulma qaçma ol dəhliz məntiqi baha bak gəl
2205,iti covi yolux təsdiqlən güman edil xəstəlik it sahib keçi b səhiyyə rəsmi hal nadir adlandır bildir itlək pişik ev heyvan virus insan keçirmə dair güclü dəlil yoq
2206,nikol pa gor yoq barə dəhliz məntiqi baha bak gəl ətraflı məlumat linkdə
2207,erməni azərbaycan gor yolunda gömrük sərhəd post yara
2208,azərbaycan müdafiə nazir zakir həs de hazırda azərbaycan ordu türk silahlı qüvvə model uyğun təşkil edilmə ordu dağ koma birlik yaradıl söhbət nədən ge
2209,b hökümət ölkə xaric gəlmə vurulan vaksinlə siyahı genişləndir london yaşıl işıq ver vaksin siyahı noyabr dən etibarən sinov olacaq astra pfizer yoxsa sinov hansı yaxşı
2210,dağlıq qara xan yaxınlığındakı rusi hərbi şəhərcik ərazi rus pravoslav kilsə açıq rusi müdafiə nazir mətbuat xidməti bildir stepanakert rus icma başçı al bod hadisə müqəddəs məna daşıyan tarixi hadisə adlandır
2211,erməni xin hesab edi bak dəhliz ideya hallandırma noyabr tarixli üçtərəfli bəyanat müddəa təhrif edi zəng dəhliz ideya üçtərəfli bəyanat zidd zəng dəhliz dalaq dirək ətraflı
2212,düz il noyabr qara hərbi əməliyyat bitmə atəşkəs barə azərbaycan erməni rusi lider birgə bəyanat imzalan həmin sənəd hansı bəndlə salın söhbət nədən gedik ətraflı
2213,noyabr bəyanat hansı bəndlə yerinə yetirilmə öhdəlik vaxt limit vaq sual cavab
2214,son ay türk lirə məzənnə müşahidə olun eniş gün davam edi dollar t qarşı faiz bahalaş təşkil edi türk yeni rekord türk lirə vəziyyət azərbaycan manat təsir edəcək
2215,azərbaycan ordu qara yaxınlığında mühasirə al yaxın erməni hərbçi geri dönmə şərait yaraq ətraflı
2216,yatma infarkt risk azal
2217,rusi qara sülhməramlı şuşa baş ver insident araşdır
2218,il gün qara hərbi əməliyyat bitmə atəşkəs barə azərbaycan erməni rusi lider birgə bəyanat imzalan arxiv
2219,ordu yalnız dağ hərbi hissə vaq artıq biz hərbi hissə sak artırıl hərbi məsələ üzrə təhlil üz cəfərov de azərbaycan ordu yaradılan yeni qurumla barə link oxu
2220,qara müharibə bitmə il öt bak yer dağlıq qaraın status dair baxış əvvəlki qütb qal azərbaycan dağlıq qara adıq ərazi mövcud olma erməni status həll gözlə de
2221,covi yoluxma öskürək asqır ağ salfet tutma yuyulma əl üz toxunma virus yoluq insan aralı durma vacib ətraflı link oxu
2222,erməni azərbaycan noyabr üçtərəfli bəyanat müddəa təhrif etmə ittiham edi azərbaycann ittiham reaksiya məlum deyil new azərbaycanca icmalıq oxu
2223,erməni azərbaycan xan yoq yaxınlığında su xətti təmir edənlər atəş açma ittiham edi azərbaycan məlumat şərh edər qarşı tərək addımla üçtərəfli bəyanat pozulma dəyərləndir
2224,b ölkə səyahət təsdiqlən vaksinlə siyahı yenilə sinov sin b covax noyabr dən etibarən qəbul edilə azərbaycan sinov tətbiq olun sinov təsirli əks təsir vaq ətraflı
2225,azərbaycan ordu dağ koma birlik yara nə
2226,azərbaycan xarici işlə nazirlik xan yoq yaxınlığında atəş bağlı rusi sülhməramlı məlumat verilmə link oxu
2227,bak yer reallaşdırılma müddəa ciddi əməl olunma sadiq qalma vacib rusi buq ötən il qara müharibə son qoy üçtərəfli bəyanat bağlı bildir ətraflı link oxu
2228,gün azərbaycan dövlət bayraq günü qeyd edil azərbaycan üçrəngli bayraq dövlət rəmzi ol azərbaycan xalq cümhuriyyət nazik şura il noyabr iclas qəbul olun dövlət bayraq günü  ilin noyabr ayıq qeyri günü
2229,erməni azərbaycan danışıq intensivləşdirilmə çağır
2230,birinci qara müharibə iştirakçı ol natiq allah il doğma ağdam ged həyəcan təsvir e bilmə dünənki gündə hələ yatma link oxu arxiv
2231,covid virus növbə boğaz tənəffüs yolla ciyər yerləş hüceyrə yoluq onlar kor fabrik çevik ətraflı link oxu
2232,yer gün keçiril müxalifət mitinq ümummilli müqavimət proses formalaş elan olun ətraflı
2233,şuşay səfər et fərq pənah xan həsrət bax youtube kanal izlə
2234,şuş cıdır düzü gəzmə hiss deyə soruş həyəcanlan gülümsə çılpaq qol irəli tutu tük biz bax hiss de b müxbir şuş səyahət qeyd link oxu bilək
2235,türki prezident re tay er noyabr prezident ilham əl zəng edər azərbaycan prezidentni zəfər günü münasibətilə təbrik edi ətraflı
2236,ötən ilin günü şuşan azad edilmə təhlil azərbaycan təxminən il müddət işğal qal torpaqla azad et müharibə qələbə demə arxiv
2237,yer müxalifət mitinq bak çaq ətraflı
2238,şuşn azad olunma il bak qeyd edil şuş şəhər il may erməni silahlı qüvvə tərəf işğal olun youtube kanal izlə arxiv
2239,ikinci qara müharibə başla azərbaycanlı erməni döyüşçü ailə danış
2240,qara qələbə azərbaycan bayram edi
2241,erməni prezident rusi sülhməramlı qara həmişəlik qalma
2242,gün yer mitinq keçiril gözlənil
2243,sevinc kədər qarışıq hislə qürur hissi çox ikinci qara müharibə illik bağlı bak sorğu link izlə
2244,il yaşama ömür deyil hesab edi millət rüsvayçılıq ikinci qara müharibə illik bağlı erməni sorğu link izlə
2245,bak zəfər günü yürük keçiril
2246,azərbaycan ikinci qara müharibə qalib gəlmə ilik bayram edi
2247,azərbaycan gün zəfər günü qeyd edi ötən il noyabr şuş şəhər azad olun b jurnalist ol i ilin sentyabr ayıq şuşda ol əvvəllər şəhər yaşa azərbaycanlı erməni sakin danış
2248,noyabr azərbaycan zəfər günü qeyd olun ötən ilin noyabr azərbaycan şuş şəhər azad edi şuş şəhər özünəməxsus arxitektura üslub uyğun ol bərpa olun ətraflı
2249,b alim aşkar edi insan pa virus huma pavirus peyvənd uşaqlıq boy xərçəng qarşı faiz alı ətraflı
2250,ukrayn rəsmi son günlə rusi sərhəd yenidən rusi hərbi texnika cəmləş bildir ki don b tətbiq et nə nəticələn bil ətraflı
2251,türki milli müdafiə nazik bak gəl ətraflı
2252,ilham əl mehriban əla şuşay gəl ətraflı
2253,peskov rusi azərbaycan erməni lider video rejim görük gələn həftə nəzər tutuq ətraflı
2254,sədri ək əkyev siyasi təzyiq element olma deyil
2255,avrop məhkəmə il azərbaycan saxlanıl erməni ta vilayəti iki sakin mamiko xocoya kar petrosyan işlək üzrə azərbaycan ümumilik min avro cərimələ azərbaycan qərar qərəzli sak ətraflı
2256,bayram görük haqqında tərək post mərhələ bölgə vəziyyət müzakirə edi
2257,bak zəfər günü qeyd etmə hazırlaş ikinci qara müharibə yekun nəzər keçiril barə ətraflı təhlili arxiv
2258,mar z fa adıq met ol deyək virtual reallıq texnologiya metvers yenidən gündəm gəl bəs internet gələcək hesab edilə metvers nə keçid oxu
2259,əfqan talib hakimiyyət gələn yüz qadın hakim gizlənmə məcburiyyət qal hakim ol bil mən orda öldür
2260,həftə əvvəli azərbaycan elektrik enerji qazın qiymət art ol bil ev iki manat et nəfərlik ailə olcaq manat civar hiss olun yeni tarik barə ətraflı
2261,noyabr zəfər günü bağlı bak nəqliyyat hansı məhdudiyyət tətbiq olun keçid oxu
2262,son məlumat azərbaycan kor infeksiya yeni yoluxma fakt qeyd alıq nəfər ölü gün qabaq yeni yoluxma sak öl sak nəfər ol tam məlumat keçid
2263,gün cəsur döyüşçü vətən uğrunda şuşan azad olunma görə təltif olun şəhid tur məmmədov şəhadət yüksəlmə ildönümü un əməkdaş şəhid məzar ziyarət edi xatirə yad edilər allah şəhid rəhmət eləsi
2264,il tarixi ədalət bərpa olun konstitusiya günü mübarək
2265,ubank gələn yenilik xəbər yox tətbiq daxil ol yuxarı sol künk profil işarə kl et açıl səhifə aşağı izlə cashbac balaq ə geri aldan topla məbləğ kart qalıq bonus uwalk topla addımla
2266,un kart üstündə olma smartfon smart saat təmas ödək ço rahat sən
2267,təmas ödəniş həzz al sən
2268,kart üstündə gəzdirmə istənil smartfo smart saat sürətli rahat təhlükəsiz ödə sən
2269,günü mübarək qalib ölkə üçrəngli şanlı bayraq noyabr bayraq
2270,cnbltntt salam şənbə bazar günlə qeyri günlədir
2271,zəfər birinci ildönümü münasibətilə un rəhbərlik əməkdaş ikinci fəxri xiyaban ziyarət edi un kollektiv biz qələbə sevinc yaşa şəhid məzar üstünə gül dəstələ qoy allah şəhid rəhmət et
2272,zəfər il mübarək azərbaycan şəhid ehtiramla yad edi zəfər
2273,un şəhid ailə bağlı həyat keçir layihə milli mükafat müsabiqə ilin yaxşı korporativ sosial məsuliyyət layihə biri seçil ətraflı
2274,öz yeni müştəri cəlb edilmə potensial görən bak ab sakin biz qoşul vakansiya haqqında ətraflı məlumat ək etmə müraciət link keç
2275,mərkəzi bank tərəf keçiril ani ödə qazan stimullaşdırıcı lotereya iştirak et qazan uban tətbiq daxil ol ani pay ödəniş sistem üzərində minimum köçürmə et qalib gələcək iştirakçı biri ol
2276,un vis kart apple pay vasitəsilə ödəniş et müxtəlif endirim hədiyyə qazan kampaniya tarixi davam edi ətraflı sən applepa vis
2277,xosse kod təstiqləm mümkün olma məlumat mərkəzi əlaqə saxla kart təstiq etmə mümkün
2278,un mastercard müştəri apple pay et ödəniş cashbac qazaq istənil su etn minimum dəyər ödəniş manat az yanacaqdoldurma məntəqə etn minimum az ödəniş manat cashbac qazandır
2279,an çoxdan böyük həyəcanla gözlə bilik apple pay artıq un un mastercard vis kart ubank müvafiq bölmə əlavə et smartfonun sağ düymə iki sıx post yaxınlaşdır ödə
2280,sək yuxu oy javan əzbərdən bil re üzrə iş təcrübə var düşünmə biz gəl komanda çalışma cvn port götür lin üzərində müraciət et
2281,termin dövriyyə et kredit götürmə imkan qazan et dövriyyə qədər cəmi dəqiqə ərzində qısamüddətli kredit ək e bilək ətraflı
2282,sadraddinov salam zəhmət olma müraciət ətraflı ol problem screen kod mobil nömrə bank ünvan göndər məsələn araşdır əlaqə saxlanıl məlumat veril
2283,payız fəs kənd təsərrüfat məhsul yetişdirmə uyğun vaxt sahə genişləndirmə biznes böyütmə illik kredit təklif edi kredit haqqında ətraflı məlumat sifariş buq bax
2284,iş yerik dəyişmə istə iş axtarış sək böyük komanda gözlə bazar risk mütəxəssis ol iş təcrübə var cvn müvafiq başlıq cvunibankaz göndər tələb tanış link keçid et
2285,biznes komissiya on idarə et dekabr qısa müddətli biznes kredit sifariş biznes əməkhaqqı kart on rəsmiləşdirilmə komissiya ətraflı
2286,vakansiya oxu öz lən yaşa müraciət komanda gəl cvn korporativ kredit mövzu dəqiqə cvunibankaz göndər öz iş axtar dost bölük bilək
2287,müstəqil əbədi yak azərbaycan
2288,dostu dəvət et qazan kampaniya müştəri dostu dəvət edər qazaq bəs qazan qazanma ubank profil daxil ol dostu dəvət et düymə kl et dəvət linkin dost göndər
2289,yüksək kommunikasiya bacar sahib müxtəlif şirkət əməkdaşlıq etmə maraqlı komanda qoşul vakansiya üzrə müraciət etmə cvn partnyor iş üzrə mütəxəssis başlıq cvunibankaz ünvan göndər
2290,ilin son wester union uban pul köçür uban promokodun istifadə et köçürmə qazan ubanı bur yüklə
2291,gürcü ölkə pul köçürmə komissiya oktyabr uban tətbiq contact pul köçürmə sistem vasitəsilə köçürmə et ubanın hələ yoq yüklə
2292,bank sahibkarlıq inkişaf fond vəsait hesab sahibkar güzəştli biznes kredit ver bank biri müraciət et biznes böyüt
2293,ödəniş təcili debet kart lazım yaxın un filial bur tap gəl yerindəcə kartnı ək et
2294,istehsal məşğul un güzəşt müddətli girov əsasında istehsal kredit biznes böyüt müraciət et
2295,istehlak kredit üzrə mütəxəssis sək xak filial gözlə böyük komanda çalışma istə cvn istehlak kredit üzrə mütəxəssisxak başlıq cvunibankaz ünvan göndər ətraflı
2296,twitter salam
2297,twitter boş tvit atma uban dəvət linkin bölüş qazan tətbiq daxil ol profil dostu uban dəvət et kl et linkin tap dost daxil ol ödəniş e qazan uban
2298,xoş xəbər artıq un vis kart and smartfonun nfc istifadə edər təmas ödək bilək ətraflı
2299,pul un debet kart saxla illik gəlir ək et üstəlik dünya istənil restoran yanacaqdoldurma məntəqə kart ödə cashbac qazan kart yoq sifariş et
2300,ubank contact pulköçürmə sistem üzərində rusi vəsait göndərmə cəmi komissiya üstəlik köçürmə kart e bilək ətraflı
2301,gün qələbə sevinc biz can qan baha bəxş e igid şəhid anım günü allah şəhid rəhmət et
2302,biznes sahib şad xəbər artıq biznes inkişaf kredit ol yek ək et filial gəlmə növbə gözləmə ətraflı
2303,rovshannesirl salam müraciət müvafiq şöbə yön əlaqə saxlanıl məlumat veril
2304,məktəbli sağlam təhsil il dərs müvəfəqiyyət həmişə məktəb olma arzu edi
2305,un kart dünya istənil yanacaqdoldurma məntəqə ödəniş et cashbac qazan kart yeniləmə lazım uban tətbiq yeni sifariş et yaxın filial gəl kart yerində ək et
2306,rahatlıq şey önəmli bank xidmət istənil yek internet bank daxil olma faydalan
2307,korifey sənətkar ruh şad artıq milli musiqi işğal azad olun torpaqla əbədi ol səslən
2308,mi ali kapital təəssürat siz yaran təəssüf edi zəhmət olma qarşılaş məsələ bağlı bank ünvan göndər məsələn araşdır
2309,jav proqramlaşdırma dik üzrə iş təcrübə malik de komanda qoşul müraciət etmə cvn sen jav de mövzu cvunibankaz ünvan göndər ətraflı
2310,ubank rusi zol kor pul köçürmə cəmi komissiya mümkün ubank daxil ol köçürmə bölmə zol kornı seç göndər ətraflı
2311,el təəssürat siz yaran təəssüf edi xidmət haqq tarif əsasən tutuq
2312,ay salam artıq balans keçmiş
2313,lvntrv un müraciət et təşəkkürlə
2314,insan resurs üzrə təcrübə qazanma sahə peşəkar kadr yetişmə istə zaman təcrübə proqram qoşul cvn insan resurs üzrə təcrübə başlıq cvunibankaz ünvan göndər ətraflı
2315,eminmammadov təəssürat siz yaran təəssüf edi köməklik göstər bilək
2316,maliyyə hesabat hazırlanma məlumat təhlili üzrə iş təcrübə sahib müraciət et müraciət etmə cvn maliyyə hesabat üzrə aparıcı mütəxəssis mövzu cvunibankaz ünvan göndər ətraflı
2317,seçim hansı filial növbə götürmə uban bank əməliyyat etmə uban istifadə etmələ ev sev film rahat bak bilək
2318,uban tətbiq istifadə etmə dostu dəvət etmə ol bil zaman video izlə dost dəvət etmə başla dəvət et dostu hədiyyə qazandır ətraflı
2319,işlək çoxlu biznes partnyor ödəniş etmə vaxt taq bilmə narahat olma günü istənil vaxt internet bank daxil ol ani pak kö sayəsində ödəniş tapşır neçə addım hazırla ödəniş et
2320,kart istə ubank daxil ol sifariş et albalı debet kart sifariş et on ödənişsiz çatdır kart haqqında ətraflı
2321,qu xak si şabran yaşa mikro kredit üzrə təcrübə sahib biz qoşul mikro kredt üzrə mütəxəssis şəhər adı başlıq cvn cvunibankaz ünvan göndər
2322,ubank istifadə edər hesab qazanma istə dost ubank istifadə etmə dəvət et dəvət et dostu qazan dəvət et qazaq bilək ətraflı
2323,un komanda üzv maliyyə departament mütəxəssis çalışma istə cvn müvafiq başlıq cvunaz ünvan göndər ətraflı
2324,el salam təəssürat siz yaran təəssüf edi zəhmət olma müraciət ətraflı ol bank ünvan göndər araşdırıl məlumat veril
2325,problem görmə gəl cəmiyyət ol yeni faciə imkan yara vətəndaş ol cür hadisə laqeyd yanaşma birlikdə sağlam cəmiyyət çalış
2326,hal kart məlumat kimsə göndərmə kart nömrələ kod kəsə bildirmə sosial şəbəkə şübhəli şəxs kredit kart sifariş aldanma əmin ol səhifə bank rəsmi səhifə bank əməkdaş vaxt kart məlumat istək
2327,depozit faiz artır yaxın olan filial depozit aç illik də gəlir ək et ətraflı
2328,dünya istənil ölkə kafe on sifariş et hesab cashbac qazan kart yox uban yüklə sifariş et yaxın filial gəl yerindəcə kartı götür
2329,and əməliyyat sistem tətbiq yaratma əsl mənlik de sək böyü komanda gözlə müvafiq vakansiya üzrə müraciət etmə and de mövzu cvn cvunibankaz ünvan göndər ətraflı
2330,ubank hesab olan məbləğ izlə ölkə ölkə pul köçür qəbul e bank xidmət ol yek faydalan bilək hələ ubank yükləmə onda smartfonun quraşdır
2331,biznes blokla məhsul üzrə xərclə bölüşdürülmə dair iş təcrübə malik müraciət et maliyyə effektiv idarə şöbə mütəxəssis mövzu cvn cvunibankaz ünvan göndər ətraflı
2332,harada olma asılı olmaya cəmi dəqiqə biznes kredit on sifariş et dərhal hesab köç
2333,dünya istənil restoran kafe un kart cashbac qazan hələ un kart yox zaman on ubank sifariş et on çatdır
2334,iyul tarixi un mastercard kart sayt ev hotel bron et cashbac qazan ətraflı
2335,un kart alma sürətli yaxın filial yaxınlaş kart dərhal yerində ək et üstəlik kart et ödəniş cashbac saxla məbləğ əlavə gəlir ək e bilək filial
2336,istilə səbəb etmə hesab banka gəlmə on aç
2337,xərclə qazan un kart dünya istənil ölkə olan kafe yanacaq doldurma məntəqə ödəniş et ödəniş cashbac qazan ubank ünvan çatdırılma kart sifariş et
2338,biznes partnyor ödəniş etmə artıq filial iş saat gözləmə xüsusi vaxt ayırma lazım deyil internet bank daxil ol ödəniş tapşır neçə addım hazırla ödəniş et
2339,bank sək tovuz filial gözlə mikro kredit üzrə iş təcrübə var cvn mikro kredit üzrə mütəxəssis filial mövzu cvunibankaz ünvan göndər ətraflı
2340,un dəstək güllə atıcılıq üzrə milli paralimpiya komanda yüksək ruh əzmlə məşq edər əsas hədəf tokio böyük qələbə yönəl komandaa uğur arzula
2341,korporativ kredit verilmə korporativ əməliyyatçı ol iş təcrübə malik zaman sək komanda gözlə komanda qoşulma cvn auditor başlıq cvunibankaz ünvan göndər ətraflı
